{
  "filters": {
    "municipality": "Penha",
    "start_date": "2025-01-01",
    "end_date": "2025-12-31"
  },
  "count": 33,
  "records": [
    {
      "type": "PhysicalObject",
      "modified": "2025-03-10T17:47:57-03:00",
      "language": "pt_BR",
      "institutionCode": "Trecho 04",
      "datasetName": "PMP-BS Área SC/PR",
      "ownerInstitutionCode": "Trecho 04",
      "basisOfRecord": "LivingSpecimen",
      "dynamicProperties": "[{\"TSN\": \"173833\", }]",
      "occurrenceID": "urn:[Trecho 04]:PMP_BS:SIMBA_226235",
      "recordNumber": "226235",
      "recordedBy": "Isabela dos Santos David",
      "individualCount": "1",
      "organismQuantity": "1",
      "organismQuantityType": "individuals",
      "associatedMedia": "https://simba.petrobras.com.br/uploads/pmp_8/executing_institution_201/individual_fauna_occurrence/67cd8e18c3a82.jpg, https://simba.petrobras.com.br/uploads/pmp_8/executing_institution_201/individual_fauna_occurrence/67cd8e25ab6bc.jpg, https://simba.petrobras.com.br/uploads/pmp_8/executing_institution_201/individual_fauna_occurrence/67cd8e31ed216.jpg, https://simba.petrobras.com.br/uploads/pmp_8/executing_institution_201/individual_fauna_occurrence/67cd8e3a05488.jpg, https://simba.petrobras.com.br/uploads/pmp_8/executing_institution_201/individual_fauna_occurrence/67cd8e470a6db.jpg, https://simba.petrobras.com.br/uploads/pmp_8/executing_institution_201/individual_fauna_occurrence/67cd8e4ca861b.jpg",
      "occurrenceRemarks": "",
      "organismID": "226235",
      "organismScope": "organismo multicelular",
      "eventID": "1955616",
      "event": "Monitoramento",
      "parentEventID": "226235",
      "fieldNumber": "",
      "eventRemarks": "Regular | Início: 09/03/2025 10:44 | Fim: 09/03/2025 11:03 | Ponto inicial: (Long: -48.6406383, Lat: -26.7695433) | Ponto final: (Long: -48.605165, Lat: -26.788995)",
      "eventDate": "2025-03-09T10:58:00-03:00",
      "locationID": "201061",
      "continent": "América do Sul",
      "country": "Brasil",
      "countryCode": "BR",
      "stateProvince": "Santa Catarina",
      "municipality": "Penha",
      "locality": "Armação",
      "decimalLatitude": "-26.78959",
      "decimalLongitude": "-48.619145",
      "geodeticDatum": "SIRGAS2000",
      "habitat": "Arenoso",
      "scientificName": "Chelonia mydas",
      "sex": "Indefinido",
      "lifeStage": "Juvenil",
      "kingdom": "Animalia",
      "phylum": "Chordate",
      "class": "Reptilia",
      "order": "Testudines",
      "family": "Cheloniidae",
      "genus": "Chelonia",
      "specificEpithet": "mydas",
      "taxonRank": "Espécie",
      "measurementID": "ID: 193908, Quelônio",
      "measurementType": "\"Comprimento total\", \"Comprimento curvilíneo carapaça\", \"Largura máxima curvilínea carapaça\", \"Comprimento curvilíneo plastrão\", \"Largura máxima curvilínea plastrão\", \"Comprimento cabeça\", \"Largura máxima cabeça\", \"Comprimento cloaca ao final cauda\", \"Comprimento plastrão ao final cauda\", \"Peso total\"",
      "measurementValue": "\"54.0000\", \"40.0000\", \"39.0000\", \"32.0000\", \"29.0000\", \"9.0000\", \"6.0000\", \"2.2000\", \"8.0000\", \"\"",
      "measurementAccuracy": "",
      "measurementUnit": "Cm",
      "measurementDeterminedBy": "Rafael Ricardo Liberato da Silva",
      "measurementDeterminedDate": "09/03/2025"
    },
    {
      "type": "PhysicalObject",
      "modified": "2025-03-08T13:16:00-03:00",
      "language": "pt_BR",
      "institutionCode": "Trecho 04",
      "datasetName": "PMP-BS Área SC/PR",
      "ownerInstitutionCode": "Trecho 04",
      "basisOfRecord": "LivingSpecimen",
      "dynamicProperties": "[{\"TSN\": \"173833\", }]",
      "occurrenceID": "urn:[Trecho 04]:PMP_BS:SIMBA_188609",
      "recordNumber": "188609",
      "recordedBy": "Thamires Pires de Pontes",
      "individualCount": "1",
      "organismQuantity": "1",
      "organismQuantityType": "individuals",
      "associatedMedia": "https://simba.petrobras.com.br/uploads/pmp_8/executing_institution_201/individual_fauna_occurrence/67cc41aaa957a.jpg, https://simba.petrobras.com.br/uploads/pmp_8/executing_institution_201/individual_fauna_occurrence/67cc41b167b2d.jpg, https://simba.petrobras.com.br/uploads/pmp_8/executing_institution_201/individual_fauna_occurrence/67cc41b912022.jpg, https://simba.petrobras.com.br/uploads/pmp_8/executing_institution_201/individual_fauna_occurrence/67cc41c06fdb1.jpg, https://simba.petrobras.com.br/uploads/pmp_8/executing_institution_201/individual_fauna_occurrence/67cc41c80fa69.jpg, https://simba.petrobras.com.br/uploads/pmp_8/executing_institution_201/individual_fauna_occurrence/67cc41cea10f0.jpg",
      "occurrenceRemarks": "",
      "organismID": "188609",
      "organismScope": "organismo multicelular",
      "eventID": "1954936",
      "event": "Monitoramento",
      "parentEventID": "188609",
      "fieldNumber": "",
      "eventRemarks": "Regular | Início: 08/03/2025 11:07 | Fim: 08/03/2025 11:12 | Ponto inicial: (Long: -48.5987933, Lat: -26.7762117) | Ponto final: (Long: -48.596975, Lat: -26.7815217)",
      "eventDate": "2025-03-08T11:09:00-03:00",
      "locationID": "201041",
      "continent": "América do Sul",
      "country": "Brasil",
      "countryCode": "BR",
      "stateProvince": "Santa Catarina",
      "municipality": "Penha",
      "locality": "Praia Grande",
      "decimalLatitude": "-26.7774683",
      "decimalLongitude": "-48.5984933",
      "geodeticDatum": "SIRGAS2000",
      "habitat": "Arenoso",
      "scientificName": "Chelonia mydas",
      "sex": "Indefinido",
      "lifeStage": "Juvenil",
      "kingdom": "Animalia",
      "phylum": "Chordate",
      "class": "Reptilia",
      "order": "Testudines",
      "family": "Cheloniidae",
      "genus": "Chelonia",
      "specificEpithet": "mydas",
      "taxonRank": "Espécie",
      "measurementID": "ID: 193869, Quelônio",
      "measurementType": "\"Comprimento total\", \"Comprimento curvilíneo carapaça\", \"Largura máxima curvilínea carapaça\", \"Comprimento curvilíneo plastrão\", \"Largura máxima curvilínea plastrão\", \"Comprimento cabeça\", \"Largura máxima cabeça\", \"Comprimento cloaca ao final cauda\", \"Comprimento plastrão ao final cauda\", \"Peso total\"",
      "measurementValue": "\"59.0000\", \"42.5000\", \"38.4000\", \"34.0000\", \"32.0000\", \"12.0000\", \"7.0000\", \"\", \"\", \"\"",
      "measurementAccuracy": "",
      "measurementUnit": "Cm",
      "measurementDeterminedBy": "Mauro Giovanni Miglioli",
      "measurementDeterminedDate": "08/03/2025"
    },
    {
      "type": "PhysicalObject",
      "modified": "",
      "language": "pt_BR",
      "institutionCode": "Trecho 04",
      "datasetName": "PMP-BS Área SC/PR",
      "ownerInstitutionCode": "Trecho 04",
      "basisOfRecord": "LivingSpecimen",
      "dynamicProperties": "[{\"TSN\": \"180411\", }]",
      "occurrenceID": "urn:[Trecho 04]:PMP_BS:SIMBA_172619",
      "recordNumber": "172619",
      "recordedBy": "Thamires Pires de Pontes",
      "individualCount": "1",
      "organismQuantity": "1",
      "organismQuantityType": "individuals",
      "associatedMedia": "https://simba.petrobras.com.br/uploads/pmp_8/executing_institution_201/individual_fauna_occurrence/67c744cdcf209.jpg, https://simba.petrobras.com.br/uploads/pmp_8/executing_institution_201/individual_fauna_occurrence/67c744d4ce9cf.jpg, https://simba.petrobras.com.br/uploads/pmp_8/executing_institution_201/individual_fauna_occurrence/67c744db90f48.jpg, https://simba.petrobras.com.br/uploads/pmp_8/executing_institution_201/individual_fauna_occurrence/67c744e57a76c.jpg, https://simba.petrobras.com.br/uploads/pmp_8/executing_institution_201/individual_fauna_occurrence/67c744edb2586.jpg, https://simba.petrobras.com.br/uploads/pmp_8/executing_institution_201/individual_fauna_occurrence/67c744f76263a.jpg, https://simba.petrobras.com.br/uploads/pmp_8/executing_institution_201/individual_fauna_occurrence/67c74500a06a4.jpg, https://simba.petrobras.com.br/uploads/pmp_8/executing_institution_201/individual_fauna_occurrence/67c7456dc1db1.jpg, https://simba.petrobras.com.br/uploads/pmp_8/executing_institution_201/individual_fauna_occurrence/67c745746ac7e.jpg",
      "occurrenceRemarks": "",
      "organismID": "172619",
      "organismScope": "organismo multicelular",
      "eventID": "69936",
      "event": "Acionamento",
      "parentEventID": "172619",
      "fieldNumber": "",
      "eventRemarks": "Acionamento | Data: 04/03/2025 16:47",
      "eventDate": "2025-03-04T17:42:00-03:00",
      "locationID": "201021",
      "continent": "América do Sul",
      "country": "Brasil",
      "countryCode": "BR",
      "stateProvince": "Santa Catarina",
      "municipality": "Penha",
      "locality": "Praia Vermelha",
      "decimalLatitude": "-26.8039855",
      "decimalLongitude": "-48.596829",
      "geodeticDatum": "SIRGAS2000",
      "habitat": "Arenoso",
      "scientificName": "Pontoporia blainvillei",
      "sex": "Indefinido",
      "lifeStage": "Juvenil",
      "kingdom": "Animalia",
      "phylum": "Chordate",
      "class": "Mammalia",
      "order": "Cetacea",
      "family": "Iniidae",
      "genus": "Pontoporia",
      "specificEpithet": "blainvillei",
      "taxonRank": "Espécie",
      "measurementID": "ID: 193662, Odontoceti",
      "measurementType": "\"Comprimento total (extremo da maxila até a reentrância caudal)\", \"Extremo da maxila ao centro do orifício respiratório\", \"Extremo da maxila ao início do melão\", \"Extremo maxila à inserção anterior da nadadeira dorsal\", \"Extremo maxila à inserção anterior da nadadeira peitoral\", \"Extremo da maxila ao centro da abertura genital\", \"Extremo da maxila ao centro do ânus\", \"Extremo da maxila até o centro do olho\", \"Comprimento da base da nadadeira dorsal\", \"Comprimento anterior da nadadeira peitoral\", \"Comprimento posterior da nadadeira peitoral\", \"Peso total\", \"Largura máxima da nadadeira peitoral\", \"Largura nadadeira caudal\", \"Circunferência do corpo na altura das axilas\", \"Altura da nadadeira dorsal\", \"Circunferência do corpo na altura do ânus\", \"Espessura da camada de gordura (região dorsal)\", \"Espessura da camada de gordura (região lateral)\", \"Espessura da camada de gordura (região ventral)\", \"Número de dentes maxila direita\", \"Número de dentes maxila esquerda\", \"Número de dentes mandíbula direita\", \"Número de dentes mandíbula esquerda\"",
      "measurementValue": "\"109.0000\", \"24.0000\", \"18.0000\", \"62.0000\", \"36.5000\", \"\", \"\", \"22.0000\", \"13.0000\", \"15.5000\", \"\", \"9.0000\", \"27.0000\", \"60.0000\", \"8.0000\", \"\", \"\", \"\", \"\", \"\", \"\", \"\", \"\"",
      "measurementAccuracy": "",
      "measurementUnit": "Cm",
      "measurementDeterminedBy": "Ian Thiago Dellarosa Bottura",
      "measurementDeterminedDate": "04/03/2025"
    },
    {
      "type": "PhysicalObject",
      "modified": "2025-03-04T13:46:35-03:00",
      "language": "pt_BR",
      "institutionCode": "Trecho 04",
      "datasetName": "PMP-BS Área SC/PR",
      "ownerInstitutionCode": "Trecho 04",
      "basisOfRecord": "LivingSpecimen",
      "dynamicProperties": "[{\"TSN\": \"173833\", }]",
      "occurrenceID": "urn:[Trecho 04]:PMP_BS:SIMBA_188555",
      "recordNumber": "188555",
      "recordedBy": "Thamires Pires de Pontes",
      "individualCount": "1",
      "organismQuantity": "1",
      "organismQuantityType": "individuals",
      "associatedMedia": "https://simba.petrobras.com.br/uploads/pmp_8/executing_institution_201/individual_fauna_occurrence/67c70284f2bbf.jpg, https://simba.petrobras.com.br/uploads/pmp_8/executing_institution_201/individual_fauna_occurrence/67c702896a9ee.jpg, https://simba.petrobras.com.br/uploads/pmp_8/executing_institution_201/individual_fauna_occurrence/67c7028e0c1fe.jpg, https://simba.petrobras.com.br/uploads/pmp_8/executing_institution_201/individual_fauna_occurrence/67c702931b105.jpg, https://simba.petrobras.com.br/uploads/pmp_8/executing_institution_201/individual_fauna_occurrence/67c702981b5c0.jpg",
      "occurrenceRemarks": "Não foi possível realizar todas as biometrias devido ao avançado estágio de decomposição.",
      "organismID": "188555",
      "organismScope": "organismo multicelular",
      "eventID": "69924",
      "event": "Acionamento",
      "parentEventID": "188555",
      "fieldNumber": "",
      "eventRemarks": "Acionamento | Data: 04/03/2025 11:37",
      "eventDate": "2025-03-04T11:47:00-03:00",
      "locationID": "201071",
      "continent": "América do Sul",
      "country": "Brasil",
      "countryCode": "BR",
      "stateProvince": "Santa Catarina",
      "municipality": "Penha",
      "locality": "Bacia da Vovó",
      "decimalLatitude": "-26.76261",
      "decimalLongitude": "-48.647265",
      "geodeticDatum": "SIRGAS2000",
      "habitat": "Arenoso",
      "scientificName": "Chelonia mydas",
      "sex": "Indefinido",
      "lifeStage": "Juvenil",
      "kingdom": "Animalia",
      "phylum": "Chordate",
      "class": "Reptilia",
      "order": "Testudines",
      "family": "Cheloniidae",
      "genus": "Chelonia",
      "specificEpithet": "mydas",
      "taxonRank": "Espécie",
      "measurementID": "ID: 193647, Quelônio",
      "measurementType": "\"Comprimento total\", \"Comprimento curvilíneo carapaça\", \"Largura máxima curvilínea carapaça\", \"Comprimento curvilíneo plastrão\", \"Largura máxima curvilínea plastrão\", \"Comprimento cabeça\", \"Largura máxima cabeça\", \"Comprimento cloaca ao final cauda\", \"Comprimento plastrão ao final cauda\", \"Peso total\"",
      "measurementValue": "\"48.0000\", \"35.0000\", \"34.0000\", \"30.0000\", \"30.0000\", \"8.0000\", \"5.0000\", \"\", \"\", \"\"",
      "measurementAccuracy": "",
      "measurementUnit": "Cm",
      "measurementDeterminedBy": "Pedro Henrique Braga Clerier",
      "measurementDeterminedDate": "04/03/2025"
    },
    {
      "type": "PhysicalObject",
      "modified": "2025-03-04T13:46:47-03:00",
      "language": "pt_BR",
      "institutionCode": "Trecho 04",
      "datasetName": "PMP-BS Área SC/PR",
      "ownerInstitutionCode": "Trecho 04",
      "basisOfRecord": "LivingSpecimen",
      "dynamicProperties": "[{\"TSN\": \"173833\", }]",
      "occurrenceID": "urn:[Trecho 04]:PMP_BS:SIMBA_188554",
      "recordNumber": "188554",
      "recordedBy": "Thamires Pires de Pontes",
      "individualCount": "1",
      "organismQuantity": "1",
      "organismQuantityType": "individuals",
      "associatedMedia": "https://simba.petrobras.com.br/uploads/pmp_8/executing_institution_201/individual_fauna_occurrence/67c7026d11985.jpg, https://simba.petrobras.com.br/uploads/pmp_8/executing_institution_201/individual_fauna_occurrence/67c7027147a89.jpg, https://simba.petrobras.com.br/uploads/pmp_8/executing_institution_201/individual_fauna_occurrence/67c702758c816.jpg, https://simba.petrobras.com.br/uploads/pmp_8/executing_institution_201/individual_fauna_occurrence/67c7027aa6028.jpg, https://simba.petrobras.com.br/uploads/pmp_8/executing_institution_201/individual_fauna_occurrence/67c7027fbcaf7.jpg",
      "occurrenceRemarks": "Não foi possível realizar todas as biometrias devido ao avançado estágio de decomposição.",
      "organismID": "188554",
      "organismScope": "organismo multicelular",
      "eventID": "69924",
      "event": "Acionamento",
      "parentEventID": "188554",
      "fieldNumber": "",
      "eventRemarks": "Acionamento | Data: 04/03/2025 11:37",
      "eventDate": "2025-03-04T11:47:00-03:00",
      "locationID": "201071",
      "continent": "América do Sul",
      "country": "Brasil",
      "countryCode": "BR",
      "stateProvince": "Santa Catarina",
      "municipality": "Penha",
      "locality": "Bacia da Vovó",
      "decimalLatitude": "-26.76261",
      "decimalLongitude": "-48.647265",
      "geodeticDatum": "SIRGAS2000",
      "habitat": "Arenoso",
      "scientificName": "Chelonia mydas",
      "sex": "Indefinido",
      "lifeStage": "Juvenil",
      "kingdom": "Animalia",
      "phylum": "Chordate",
      "class": "Reptilia",
      "order": "Testudines",
      "family": "Cheloniidae",
      "genus": "Chelonia",
      "specificEpithet": "mydas",
      "taxonRank": "Espécie",
      "measurementID": "ID: 193646, Quelônio",
      "measurementType": "\"Comprimento total\", \"Comprimento curvilíneo carapaça\", \"Largura máxima curvilínea carapaça\", \"Comprimento curvilíneo plastrão\", \"Largura máxima curvilínea plastrão\", \"Comprimento cabeça\", \"Largura máxima cabeça\", \"Comprimento cloaca ao final cauda\", \"Comprimento plastrão ao final cauda\", \"Peso total\"",
      "measurementValue": "\"50.5000\", \"\", \"34.5000\", \"32.0000\", \"29.0000\", \"10.0000\", \"7.0000\", \"\", \"\", \"\"",
      "measurementAccuracy": "",
      "measurementUnit": "Cm",
      "measurementDeterminedBy": "Pedro Henrique Braga Clerier",
      "measurementDeterminedDate": "04/03/2025"
    },
    {
      "type": "PhysicalObject",
      "modified": "2025-02-28T14:33:05-03:00",
      "language": "pt_BR",
      "institutionCode": "Trecho 04",
      "datasetName": "PMP-BS Área SC/PR",
      "ownerInstitutionCode": "Trecho 04",
      "basisOfRecord": "LivingSpecimen",
      "dynamicProperties": "[{\"TSN\": \"173833\", }]",
      "occurrenceID": "urn:[Trecho 04]:PMP_BS:SIMBA_218812",
      "recordNumber": "218812",
      "recordedBy": "Thamires Pires de Pontes",
      "individualCount": "1",
      "organismQuantity": "1",
      "organismQuantityType": "individuals",
      "associatedMedia": "https://simba.petrobras.com.br/uploads/pmp_8/executing_institution_201/individual_fauna_occurrence/67c0696329a34.jpg, https://simba.petrobras.com.br/uploads/pmp_8/executing_institution_201/individual_fauna_occurrence/67c069cce915f.jpg, https://simba.petrobras.com.br/uploads/pmp_8/executing_institution_201/individual_fauna_occurrence/67c069d23c0c4.jpg, https://simba.petrobras.com.br/uploads/pmp_8/executing_institution_201/individual_fauna_occurrence/67c069da2c459.jpg, https://simba.petrobras.com.br/uploads/pmp_8/executing_institution_201/individual_fauna_occurrence/67c069e59829b.jpg",
      "occurrenceRemarks": "",
      "organismID": "218812",
      "organismScope": "organismo multicelular",
      "eventID": "69803",
      "event": "Acionamento",
      "parentEventID": "218812",
      "fieldNumber": "",
      "eventRemarks": "Acionamento | Data: 26/02/2025 16:54",
      "eventDate": "2025-02-27T11:06:00-03:00",
      "locationID": "201061",
      "continent": "América do Sul",
      "country": "Brasil",
      "countryCode": "BR",
      "stateProvince": "Santa Catarina",
      "municipality": "Penha",
      "locality": "Armação",
      "decimalLatitude": "-26.78474",
      "decimalLongitude": "-48.628385",
      "geodeticDatum": "SIRGAS2000",
      "habitat": "Arenoso",
      "scientificName": "Chelonia mydas",
      "sex": "Indefinido",
      "lifeStage": "Juvenil",
      "kingdom": "Animalia",
      "phylum": "Chordate",
      "class": "Reptilia",
      "order": "Testudines",
      "family": "Cheloniidae",
      "genus": "Chelonia",
      "specificEpithet": "mydas",
      "taxonRank": "Espécie",
      "measurementID": "ID: 193428, Quelônio",
      "measurementType": "\"Comprimento total\", \"Comprimento curvilíneo carapaça\", \"Largura máxima curvilínea carapaça\", \"Comprimento curvilíneo plastrão\", \"Largura máxima curvilínea plastrão\", \"Comprimento cabeça\", \"Largura máxima cabeça\", \"Comprimento cloaca ao final cauda\", \"Comprimento plastrão ao final cauda\", \"Peso total\"",
      "measurementValue": "\"\", \"43.0000\", \"39.0000\", \"32.5000\", \"31.0000\", \"\", \"\", \"\", \"\", \"\"",
      "measurementAccuracy": "",
      "measurementUnit": "Cm",
      "measurementDeterminedBy": "Douglas Coutinho Machado",
      "measurementDeterminedDate": "27/02/2025"
    },
    {
      "type": "PhysicalObject",
      "modified": "2025-03-01T15:44:16-03:00",
      "language": "pt_BR",
      "institutionCode": "Trecho 04",
      "datasetName": "PMP-BS Área SC/PR",
      "ownerInstitutionCode": "Trecho 04",
      "basisOfRecord": "LivingSpecimen",
      "dynamicProperties": "[{\"TSN\": \"173840\", }]",
      "occurrenceID": "urn:[Trecho 04]:PMP_BS:SIMBA_172617",
      "recordNumber": "172617",
      "recordedBy": "Thamires Pires de Pontes",
      "individualCount": "1",
      "organismQuantity": "1",
      "organismQuantityType": "individuals",
      "associatedMedia": "https://simba.petrobras.com.br/uploads/pmp_8/executing_institution_201/individual_fauna_occurrence/67bf15cd847f6.jpg, https://simba.petrobras.com.br/uploads/pmp_8/executing_institution_201/individual_fauna_occurrence/67bf15d24e62c.jpg, https://simba.petrobras.com.br/uploads/pmp_8/executing_institution_201/individual_fauna_occurrence/67bf15d6c8e4b.jpg, https://simba.petrobras.com.br/uploads/pmp_8/executing_institution_201/individual_fauna_occurrence/67bf15db03f8b.jpg, https://simba.petrobras.com.br/uploads/pmp_8/executing_institution_201/individual_fauna_occurrence/67bf15dec974f.jpg",
      "occurrenceRemarks": "Lesões arredondadas no dorso da cabeça, compatível com predação por animais necrófagos. Carapaça será macerada na Unidade de Penha para ser utilizada em Educação ambiental.",
      "organismID": "172617",
      "organismScope": "organismo multicelular",
      "eventID": "69798",
      "event": "Acionamento",
      "parentEventID": "172617",
      "fieldNumber": "",
      "eventRemarks": "Acionamento | Data: 26/02/2025 12:46",
      "eventDate": "2025-02-26T12:51:00-03:00",
      "locationID": "201061",
      "continent": "América do Sul",
      "country": "Brasil",
      "countryCode": "BR",
      "stateProvince": "Santa Catarina",
      "municipality": "Penha",
      "locality": "Armação",
      "decimalLatitude": "-26.7871641",
      "decimalLongitude": "-48.6249591",
      "geodeticDatum": "SIRGAS2000",
      "habitat": "Arenoso",
      "scientificName": "Lepidochelys olivacea",
      "sex": "Fêmea",
      "lifeStage": "Adulto",
      "kingdom": "Animalia",
      "phylum": "Chordate",
      "class": "Reptilia",
      "order": "Testudines",
      "family": "Cheloniidae",
      "genus": "Lepidochelys",
      "specificEpithet": "olivacea",
      "taxonRank": "Espécie",
      "measurementID": "ID: 193385, Quelônio",
      "measurementType": "\"Comprimento total\", \"Comprimento curvilíneo carapaça\", \"Largura máxima curvilínea carapaça\", \"Comprimento curvilíneo plastrão\", \"Largura máxima curvilínea plastrão\", \"Comprimento cabeça\", \"Largura máxima cabeça\", \"Comprimento cloaca ao final cauda\", \"Comprimento plastrão ao final cauda\", \"Peso total\"",
      "measurementValue": "\"91.6000\", \"65.0000\", \"64.9000\", \"47.7000\", \"47.0000\", \"18.2000\", \"12.3000\", \"5.6000\", \"10.6000\", \"26.2500\"",
      "measurementAccuracy": "",
      "measurementUnit": "Cm",
      "measurementDeterminedBy": "Juliana Pinto Corrêa dos Santos",
      "measurementDeterminedDate": "26/02/2025"
    },
    {
      "type": "PhysicalObject",
      "modified": "2025-02-26T16:12:56-03:00",
      "language": "pt_BR",
      "institutionCode": "Trecho 04",
      "datasetName": "PMP-BS Área SC/PR",
      "ownerInstitutionCode": "Trecho 04",
      "basisOfRecord": "LivingSpecimen",
      "dynamicProperties": "[{\"TSN\": \"173833\", }]",
      "occurrenceID": "urn:[Trecho 04]:PMP_BS:SIMBA_218810",
      "recordNumber": "218810",
      "recordedBy": "Thamires Pires de Pontes",
      "individualCount": "1",
      "organismQuantity": "1",
      "organismQuantityType": "individuals",
      "associatedMedia": "https://simba.petrobras.com.br/uploads/pmp_8/executing_institution_201/individual_fauna_occurrence/67bf170aa0916.jpg, https://simba.petrobras.com.br/uploads/pmp_8/executing_institution_201/individual_fauna_occurrence/67bf170f837cc.jpg, https://simba.petrobras.com.br/uploads/pmp_8/executing_institution_201/individual_fauna_occurrence/67bf17140bdec.jpg, https://simba.petrobras.com.br/uploads/pmp_8/executing_institution_201/individual_fauna_occurrence/67bf171862c51.jpg, https://simba.petrobras.com.br/uploads/pmp_8/executing_institution_201/individual_fauna_occurrence/67bf171c8d85f.jpg, https://simba.petrobras.com.br/uploads/pmp_8/executing_institution_201/individual_fauna_occurrence/67bf1720a24f0.jpg",
      "occurrenceRemarks": "Não foi possível realizar todas as biometrias devido ao avançado estágio de decomposição.",
      "organismID": "218810",
      "organismScope": "organismo multicelular",
      "eventID": "1947224",
      "event": "Monitoramento",
      "parentEventID": "218810",
      "fieldNumber": "",
      "eventRemarks": "Regular | Início: 26/02/2025 10:54 | Fim: 26/02/2025 11:00 | Ponto inicial: (Long: -48.6610083, Lat: -26.7711583) | Ponto final: (Long: -48.6526367, Lat: -26.771695)",
      "eventDate": "2025-02-26T10:56:00-03:00",
      "locationID": "201081",
      "continent": "América do Sul",
      "country": "Brasil",
      "countryCode": "BR",
      "stateProvince": "Santa Catarina",
      "municipality": "Penha",
      "locality": "Praia Alegre",
      "decimalLatitude": "-26.7718717",
      "decimalLongitude": "-48.6588383",
      "geodeticDatum": "SIRGAS2000",
      "habitat": "Arenoso",
      "scientificName": "Chelonia mydas",
      "sex": "Indefinido",
      "lifeStage": "Juvenil",
      "kingdom": "Animalia",
      "phylum": "Chordate",
      "class": "Reptilia",
      "order": "Testudines",
      "family": "Cheloniidae",
      "genus": "Chelonia",
      "specificEpithet": "mydas",
      "taxonRank": "Espécie",
      "measurementID": "ID: 193387, Quelônio",
      "measurementType": "\"Comprimento total\", \"Comprimento curvilíneo carapaça\", \"Largura máxima curvilínea carapaça\", \"Comprimento curvilíneo plastrão\", \"Largura máxima curvilínea plastrão\", \"Comprimento cabeça\", \"Largura máxima cabeça\", \"Comprimento cloaca ao final cauda\", \"Comprimento plastrão ao final cauda\", \"Peso total\"",
      "measurementValue": "\"51.0000\", \"38.5000\", \"35.0000\", \"31.0000\", \"27.5000\", \"11.0000\", \"6.5000\", \"\", \"\", \"\"",
      "measurementAccuracy": "",
      "measurementUnit": "Cm",
      "measurementDeterminedBy": "Pedro Henrique Braga Clerier",
      "measurementDeterminedDate": "26/02/2025"
    },
    {
      "type": "PhysicalObject",
      "modified": "",
      "language": "pt_BR",
      "institutionCode": "Trecho 04",
      "datasetName": "PMP-BS Área SC/PR",
      "ownerInstitutionCode": "Trecho 04",
      "basisOfRecord": "LivingSpecimen",
      "dynamicProperties": "[{\"TSN\": \"173833\", }]",
      "occurrenceID": "urn:[Trecho 04]:PMP_BS:SIMBA_172615",
      "recordNumber": "172615",
      "recordedBy": "Isabela dos Santos David",
      "individualCount": "1",
      "organismQuantity": "1",
      "organismQuantityType": "individuals",
      "associatedMedia": "https://simba.petrobras.com.br/uploads/pmp_8/executing_institution_201/individual_fauna_occurrence/67bdf8c9db116.jpg, https://simba.petrobras.com.br/uploads/pmp_8/executing_institution_201/individual_fauna_occurrence/67bdf8ce60dd3.jpg, https://simba.petrobras.com.br/uploads/pmp_8/executing_institution_201/individual_fauna_occurrence/67bdf8d294754.jpg, https://simba.petrobras.com.br/uploads/pmp_8/executing_institution_201/individual_fauna_occurrence/67bdf8d74a5bd.jpg, https://simba.petrobras.com.br/uploads/pmp_8/executing_institution_201/individual_fauna_occurrence/67bdf8db9019d.jpg",
      "occurrenceRemarks": "",
      "organismID": "172615",
      "organismScope": "organismo multicelular",
      "eventID": "1946614",
      "event": "Monitoramento",
      "parentEventID": "172615",
      "fieldNumber": "",
      "eventRemarks": "Regular | Início: 25/02/2025 11:56 | Fim: 25/02/2025 12:41 | Ponto inicial: (Long: -48.64075, Lat: -26.7692196) | Ponto final: (Long: -48.6051917, Lat: -26.78714)",
      "eventDate": "2025-02-25T12:30:00-03:00",
      "locationID": "201061",
      "continent": "América do Sul",
      "country": "Brasil",
      "countryCode": "BR",
      "stateProvince": "Santa Catarina",
      "municipality": "Penha",
      "locality": "Armação",
      "decimalLatitude": "-26.7857383",
      "decimalLongitude": "-48.6268317",
      "geodeticDatum": "SIRGAS2000",
      "habitat": "Arenoso",
      "scientificName": "Chelonia mydas",
      "sex": "Indefinido",
      "lifeStage": "Juvenil",
      "kingdom": "Animalia",
      "phylum": "Chordate",
      "class": "Reptilia",
      "order": "Testudines",
      "family": "Cheloniidae",
      "genus": "Chelonia",
      "specificEpithet": "mydas",
      "taxonRank": "Espécie",
      "measurementID": "ID: 193364, Quelônio",
      "measurementType": "\"Comprimento total\", \"Comprimento curvilíneo carapaça\", \"Largura máxima curvilínea carapaça\", \"Comprimento curvilíneo plastrão\", \"Largura máxima curvilínea plastrão\", \"Comprimento cabeça\", \"Largura máxima cabeça\", \"Comprimento cloaca ao final cauda\", \"Comprimento plastrão ao final cauda\", \"Peso total\"",
      "measurementValue": "\"53.0000\", \"40.0000\", \"38.0000\", \"34.0000\", \"31.0000\", \"13.0000\", \"9.0000\", \"\", \"\", \"\"",
      "measurementAccuracy": "",
      "measurementUnit": "Cm",
      "measurementDeterminedBy": "Mauro Giovanni Miglioli",
      "measurementDeterminedDate": "25/02/2025"
    },
    {
      "type": "PhysicalObject",
      "modified": "2025-02-25T17:10:17-03:00",
      "language": "pt_BR",
      "institutionCode": "Trecho 04",
      "datasetName": "PMP-BS Área SC/PR",
      "ownerInstitutionCode": "Trecho 04",
      "basisOfRecord": "LivingSpecimen",
      "dynamicProperties": "[{\"TSN\": \"173830\", }]",
      "occurrenceID": "urn:[Trecho 04]:PMP_BS:SIMBA_172368",
      "recordNumber": "172368",
      "recordedBy": "Isabela dos Santos David",
      "individualCount": "1",
      "organismQuantity": "1",
      "organismQuantityType": "individuals",
      "associatedMedia": "https://simba.petrobras.com.br/uploads/pmp_8/executing_institution_201/individual_fauna_occurrence/67bdf8b0ee9dd.jpg, https://simba.petrobras.com.br/uploads/pmp_8/executing_institution_201/individual_fauna_occurrence/67bdf8b55175b.jpg, https://simba.petrobras.com.br/uploads/pmp_8/executing_institution_201/individual_fauna_occurrence/67bdf8b980c14.jpg, https://simba.petrobras.com.br/uploads/pmp_8/executing_institution_201/individual_fauna_occurrence/67bdf8bd9078b.jpg, https://simba.petrobras.com.br/uploads/pmp_8/executing_institution_201/individual_fauna_occurrence/67bdf8c1d1c6a.jpg, https://simba.petrobras.com.br/uploads/pmp_8/executing_institution_201/individual_fauna_occurrence/67bdf8c60762c.jpg",
      "occurrenceRemarks": "",
      "organismID": "172368",
      "organismScope": "organismo multicelular",
      "eventID": "1946614",
      "event": "Monitoramento",
      "parentEventID": "172368",
      "fieldNumber": "",
      "eventRemarks": "Regular | Início: 25/02/2025 11:56 | Fim: 25/02/2025 12:41 | Ponto inicial: (Long: -48.64075, Lat: -26.7692196) | Ponto final: (Long: -48.6051917, Lat: -26.78714)",
      "eventDate": "2025-02-25T12:01:00-03:00",
      "locationID": "201061",
      "continent": "América do Sul",
      "country": "Brasil",
      "countryCode": "BR",
      "stateProvince": "Santa Catarina",
      "municipality": "Penha",
      "locality": "Armação",
      "decimalLatitude": "-26.7795517",
      "decimalLongitude": "-48.6336483",
      "geodeticDatum": "SIRGAS2000",
      "habitat": "Arenoso",
      "scientificName": "Caretta caretta",
      "sex": "Indefinido",
      "lifeStage": "Juvenil",
      "kingdom": "Animalia",
      "phylum": "Chordate",
      "class": "Reptilia",
      "order": "Testudines",
      "family": "Cheloniidae",
      "genus": "Caretta",
      "specificEpithet": "caretta",
      "taxonRank": "Espécie",
      "measurementID": "ID: 193363, Quelônio",
      "measurementType": "\"Comprimento total\", \"Comprimento curvilíneo carapaça\", \"Largura máxima curvilínea carapaça\", \"Comprimento curvilíneo plastrão\", \"Largura máxima curvilínea plastrão\", \"Comprimento cabeça\", \"Largura máxima cabeça\", \"Comprimento cloaca ao final cauda\", \"Comprimento plastrão ao final cauda\", \"Peso total\"",
      "measurementValue": "\"90.0000\", \"74.0000\", \"73.0000\", \"54.0000\", \"52.0000\", \"19.0000\", \"16.0000\", \"\", \"\", \"\"",
      "measurementAccuracy": "",
      "measurementUnit": "Cm",
      "measurementDeterminedBy": "Mauro Giovanni Miglioli",
      "measurementDeterminedDate": "25/02/2025"
    },
    {
      "type": "PhysicalObject",
      "modified": "2025-02-23T16:57:32-03:00",
      "language": "pt_BR",
      "institutionCode": "Trecho 04",
      "datasetName": "PMP-BS Área SC/PR",
      "ownerInstitutionCode": "Trecho 04",
      "basisOfRecord": "LivingSpecimen",
      "dynamicProperties": "[{\"TSN\": \"173833\", }]",
      "occurrenceID": "urn:[Trecho 04]:PMP_BS:SIMBA_172323",
      "recordNumber": "172323",
      "recordedBy": "Isabela dos Santos David",
      "individualCount": "1",
      "organismQuantity": "1",
      "organismQuantityType": "individuals",
      "associatedMedia": "https://simba.petrobras.com.br/uploads/pmp_8/executing_institution_201/individual_fauna_occurrence/67ba2bf821f75.jpg, https://simba.petrobras.com.br/uploads/pmp_8/executing_institution_201/individual_fauna_occurrence/67bb5369c1abb.jpg, https://simba.petrobras.com.br/uploads/pmp_8/executing_institution_201/individual_fauna_occurrence/67bb53694a8de.jpg, https://simba.petrobras.com.br/uploads/pmp_8/executing_institution_201/individual_fauna_occurrence/67bb53699b3ae.jpg, https://simba.petrobras.com.br/uploads/pmp_8/executing_institution_201/individual_fauna_occurrence/67bb5369248f0.jpg, https://simba.petrobras.com.br/uploads/pmp_8/executing_institution_201/individual_fauna_occurrence/67bb53697474b.jpg",
      "occurrenceRemarks": "",
      "organismID": "172323",
      "organismScope": "organismo multicelular",
      "eventID": "69718",
      "event": "Acionamento",
      "parentEventID": "172323",
      "fieldNumber": "",
      "eventRemarks": "Acionamento | Data: 22/02/2025 18:54",
      "eventDate": "2025-02-22T19:21:00-03:00",
      "locationID": "201071",
      "continent": "América do Sul",
      "country": "Brasil",
      "countryCode": "BR",
      "stateProvince": "Santa Catarina",
      "municipality": "Penha",
      "locality": "Bacia da Vovó",
      "decimalLatitude": "-26.7665463",
      "decimalLongitude": "-48.644657",
      "geodeticDatum": "SIRGAS2000",
      "habitat": "Arenoso",
      "scientificName": "Chelonia mydas",
      "sex": "Indefinido",
      "lifeStage": "Juvenil",
      "kingdom": "Animalia",
      "phylum": "Chordate",
      "class": "Reptilia",
      "order": "Testudines",
      "family": "Cheloniidae",
      "genus": "Chelonia",
      "specificEpithet": "mydas",
      "taxonRank": "Espécie",
      "measurementID": "ID: 193258, Quelônio",
      "measurementType": "\"Comprimento total\", \"Comprimento curvilíneo carapaça\", \"Largura máxima curvilínea carapaça\", \"Comprimento curvilíneo plastrão\", \"Largura máxima curvilínea plastrão\", \"Comprimento cabeça\", \"Largura máxima cabeça\", \"Comprimento cloaca ao final cauda\", \"Comprimento plastrão ao final cauda\", \"Peso total\"",
      "measurementValue": "\"55.0000\", \"40.0000\", \"38.0000\", \"33.0000\", \"30.0000\", \"12.0000\", \"7.0000\", \"2.5000\", \"7.5000\", \"8.3500\"",
      "measurementAccuracy": "",
      "measurementUnit": "Cm",
      "measurementDeterminedBy": "Juliana Pinto Corrêa dos Santos",
      "measurementDeterminedDate": "22/02/2025"
    },
    {
      "type": "PhysicalObject",
      "modified": "2025-02-21T13:16:16-03:00",
      "language": "pt_BR",
      "institutionCode": "Trecho 04",
      "datasetName": "PMP-BS Área SC/PR",
      "ownerInstitutionCode": "Trecho 04",
      "basisOfRecord": "LivingSpecimen",
      "dynamicProperties": "[{\"TSN\": \"173833\", }]",
      "occurrenceID": "urn:[Trecho 04]:PMP_BS:SIMBA_218715",
      "recordNumber": "218715",
      "recordedBy": "Isabela dos Santos David",
      "individualCount": "1",
      "organismQuantity": "1",
      "organismQuantityType": "individuals",
      "associatedMedia": "https://simba.petrobras.com.br/uploads/pmp_8/executing_institution_201/individual_fauna_occurrence/67b757ef641cf.jpg, https://simba.petrobras.com.br/uploads/pmp_8/executing_institution_201/individual_fauna_occurrence/67b757f46f35e.jpg, https://simba.petrobras.com.br/uploads/pmp_8/executing_institution_201/individual_fauna_occurrence/67b757f934130.jpg, https://simba.petrobras.com.br/uploads/pmp_8/executing_institution_201/individual_fauna_occurrence/67b757fd2bab0.jpg, https://simba.petrobras.com.br/uploads/pmp_8/executing_institution_201/individual_fauna_occurrence/67b758b06750c.jpeg",
      "occurrenceRemarks": "Não foi possível realizar todas as biometrias devido ao avançado estágio de decomposição.",
      "organismID": "218715",
      "organismScope": "organismo multicelular",
      "eventID": "69684",
      "event": "Acionamento",
      "parentEventID": "218715",
      "fieldNumber": "",
      "eventRemarks": "Acionamento | Data: 20/02/2025 15:35",
      "eventDate": "2025-02-20T15:51:00-03:00",
      "locationID": "201061",
      "continent": "América do Sul",
      "country": "Brasil",
      "countryCode": "BR",
      "stateProvince": "Santa Catarina",
      "municipality": "Penha",
      "locality": "Armação",
      "decimalLatitude": "-26.7866867",
      "decimalLongitude": "-48.6255117",
      "geodeticDatum": "SIRGAS2000",
      "habitat": "Arenoso",
      "scientificName": "Chelonia mydas",
      "sex": "Indefinido",
      "lifeStage": "Juvenil",
      "kingdom": "Animalia",
      "phylum": "Chordate",
      "class": "Reptilia",
      "order": "Testudines",
      "family": "Cheloniidae",
      "genus": "Chelonia",
      "specificEpithet": "mydas",
      "taxonRank": "Espécie",
      "measurementID": "ID: 193135, Quelônio",
      "measurementType": "\"Comprimento total\", \"Comprimento curvilíneo carapaça\", \"Largura máxima curvilínea carapaça\", \"Comprimento curvilíneo plastrão\", \"Largura máxima curvilínea plastrão\", \"Comprimento cabeça\", \"Largura máxima cabeça\", \"Comprimento cloaca ao final cauda\", \"Comprimento plastrão ao final cauda\", \"Peso total\"",
      "measurementValue": "\"71.0000\", \"54.0000\", \"48.0000\", \"43.0000\", \"38.0000\", \"11.5000\", \"8.0000\", \"\", \"\", \"\"",
      "measurementAccuracy": "",
      "measurementUnit": "Cm",
      "measurementDeterminedBy": "Pedro Henrique Braga Clerier",
      "measurementDeterminedDate": "20/02/2025"
    },
    {
      "type": "PhysicalObject",
      "modified": "2025-02-16T14:10:02-03:00",
      "language": "pt_BR",
      "institutionCode": "Trecho 04",
      "datasetName": "PMP-BS Área SC/PR",
      "ownerInstitutionCode": "Trecho 04",
      "basisOfRecord": "LivingSpecimen",
      "dynamicProperties": "[{\"TSN\": \"176849\", }]",
      "occurrenceID": "urn:[Trecho 04]:PMP_BS:SIMBA_966717",
      "recordNumber": "966717",
      "recordedBy": "Isabela dos Santos David",
      "individualCount": "1",
      "organismQuantity": "1",
      "organismQuantityType": "individuals",
      "associatedMedia": "https://simba.petrobras.com.br/uploads/pmp_8/executing_institution_201/individual_fauna_occurrence/67b1dc427949d.jpeg, https://simba.petrobras.com.br/uploads/pmp_8/executing_institution_201/individual_fauna_occurrence/67b1efe28bd57.jpeg, https://simba.petrobras.com.br/uploads/pmp_8/executing_institution_201/individual_fauna_occurrence/67b1efe30b915.jpeg, https://simba.petrobras.com.br/uploads/pmp_8/executing_institution_201/individual_fauna_occurrence/67b1efe2c0497.jpeg",
      "occurrenceRemarks": "Animal devorado por predadores não sendo possivel fazer biometria nem fotos com trena para registro.\nPrimeira foto o acionante tirou no dia anterior ( 15/02/2025 ) e nos avisou desse animal no dia seguinte ( 16/02/2025)  com isso o animal estava num estado maior de decomposição!",
      "organismID": "966717",
      "organismScope": "organismo multicelular",
      "eventID": "69611",
      "event": "Acionamento",
      "parentEventID": "966717",
      "fieldNumber": "",
      "eventRemarks": "Acionamento | Data: 16/02/2025 12:30",
      "eventDate": "2025-02-16T12:35:00-03:00",
      "locationID": "201021",
      "continent": "América do Sul",
      "country": "Brasil",
      "countryCode": "BR",
      "stateProvince": "Santa Catarina",
      "municipality": "Penha",
      "locality": "Praia Vermelha",
      "decimalLatitude": "-26.7966034",
      "decimalLongitude": "-48.5903835",
      "geodeticDatum": "SIRGAS2000",
      "habitat": "Arenoso",
      "scientificName": "Larus dominicanus",
      "sex": "Indefinido",
      "lifeStage": "Adulto",
      "kingdom": "Animalia",
      "phylum": "Chordate",
      "class": "Aves",
      "order": "Charadriiformes",
      "family": "Laridae",
      "genus": "Larus",
      "specificEpithet": "dominicanus",
      "taxonRank": "Espécie"
    },
    {
      "type": "PhysicalObject",
      "modified": "2025-03-01T14:41:52-03:00",
      "language": "pt_BR",
      "institutionCode": "Trecho 04",
      "datasetName": "PMP-BS Área SC/PR",
      "ownerInstitutionCode": "Trecho 04",
      "basisOfRecord": "LivingSpecimen",
      "dynamicProperties": "[{\"TSN\": \"180411\", }]",
      "occurrenceID": "urn:[Trecho 04]:PMP_BS:SIMBA_218551",
      "recordNumber": "218551",
      "recordedBy": "Thamires Pires de Pontes",
      "individualCount": "1",
      "organismQuantity": "1",
      "organismQuantityType": "individuals",
      "associatedMedia": "https://simba.petrobras.com.br/uploads/pmp_8/executing_institution_201/individual_fauna_occurrence/67b1fa0032781.jpg, https://simba.petrobras.com.br/uploads/pmp_8/executing_institution_201/individual_fauna_occurrence/67b1fa061918d.jpg, https://simba.petrobras.com.br/uploads/pmp_8/executing_institution_201/individual_fauna_occurrence/67b1fa0c7e514.jpg, https://simba.petrobras.com.br/uploads/pmp_8/executing_institution_201/individual_fauna_occurrence/67b1fa11d076d.jpg, https://simba.petrobras.com.br/uploads/pmp_8/executing_institution_201/individual_fauna_occurrence/67b1fa19c379d.jpg, https://simba.petrobras.com.br/uploads/pmp_8/executing_institution_201/individual_fauna_occurrence/67b1fa207bd9f.jpg, https://simba.petrobras.com.br/uploads/pmp_8/executing_institution_201/individual_fauna_occurrence/67b1fa269a329.jpg, https://simba.petrobras.com.br/uploads/pmp_8/executing_institution_201/individual_fauna_occurrence/67b1fa2ebb77b.jpg, https://simba.petrobras.com.br/uploads/pmp_8/executing_institution_201/individual_fauna_occurrence/67b1fa352e0cc.jpg, https://simba.petrobras.com.br/uploads/pmp_8/executing_institution_201/individual_fauna_occurrence/67b1fa3b862e2.jpg, https://simba.petrobras.com.br/uploads/pmp_8/executing_institution_201/individual_fauna_occurrence/67b1fa5fef293.jpg, https://simba.petrobras.com.br/uploads/pmp_8/executing_institution_201/individual_fauna_occurrence/67b1fa69b9ea7.jpg, https://simba.petrobras.com.br/uploads/pmp_8/executing_institution_201/individual_fauna_occurrence/67b1fa7850288.jpg, https://simba.petrobras.com.br/uploads/pmp_8/executing_institution_201/individual_fauna_occurrence/67b1faa43d888.jpg, https://simba.petrobras.com.br/uploads/pmp_8/executing_institution_201/individual_fauna_occurrence/67c31c63670b2.jpg, https://simba.petrobras.com.br/uploads/pmp_8/executing_institution_201/individual_fauna_occurrence/67c31c6332415.jpg, https://simba.petrobras.com.br/uploads/pmp_8/executing_institution_201/individual_fauna_occurrence/67c31c9469148.jpg",
      "occurrenceRemarks": "Lesão perfurativa em região ventral, próxima ao esterno. Marca linear e deprimida na base do rostro (possível interação com pesca). Marcas lineares e paralelas em região de rostro, compatíveis com interação intraespecífica. Descamação da pele e coloração avermelhada (alterações do processo de autólise).",
      "organismID": "218551",
      "organismScope": "organismo multicelular",
      "eventID": "69607",
      "event": "Acionamento",
      "parentEventID": "218551",
      "fieldNumber": "",
      "eventRemarks": "Acionamento | Data: 16/02/2025 01:00",
      "eventDate": "2025-02-16T10:57:00-03:00",
      "locationID": "201061",
      "continent": "América do Sul",
      "country": "Brasil",
      "countryCode": "BR",
      "stateProvince": "Santa Catarina",
      "municipality": "Penha",
      "locality": "Armação",
      "decimalLatitude": "-26.77245",
      "decimalLongitude": "-48.6385",
      "geodeticDatum": "SIRGAS2000",
      "habitat": "Arenoso",
      "scientificName": "Pontoporia blainvillei",
      "sex": "Macho",
      "lifeStage": "Adulto",
      "kingdom": "Animalia",
      "phylum": "Chordate",
      "class": "Mammalia",
      "order": "Cetacea",
      "family": "Iniidae",
      "genus": "Pontoporia",
      "specificEpithet": "blainvillei",
      "taxonRank": "Espécie",
      "measurementID": "ID: 192902, Odontoceti",
      "measurementType": "\"Comprimento total (extremo da maxila até a reentrância caudal)\", \"Extremo da maxila ao centro do orifício respiratório\", \"Extremo da maxila ao início do melão\", \"Extremo maxila à inserção anterior da nadadeira dorsal\", \"Extremo maxila à inserção anterior da nadadeira peitoral\", \"Extremo da maxila ao centro da abertura genital\", \"Extremo da maxila ao centro do ânus\", \"Extremo da maxila até o centro do olho\", \"Comprimento da base da nadadeira dorsal\", \"Comprimento anterior da nadadeira peitoral\", \"Comprimento posterior da nadadeira peitoral\", \"Peso total\", \"Largura máxima da nadadeira peitoral\", \"Largura nadadeira caudal\", \"Circunferência do corpo na altura das axilas\", \"Altura da nadadeira dorsal\", \"Circunferência do corpo na altura do ânus\", \"Espessura da camada de gordura (região dorsal)\", \"Espessura da camada de gordura (região lateral)\", \"Espessura da camada de gordura (região ventral)\", \"Número de dentes maxila direita\", \"Número de dentes maxila esquerda\", \"Número de dentes mandíbula direita\", \"Número de dentes mandíbula esquerda\"",
      "measurementValue": "\"117.0000\", \"26.0000\", \"16.0000\", \"\", \"39.0000\", \"72.0000\", \"82.0000\", \"22.0000\", \"19.0000\", \"17.5000\", \"13.4500\", \"10.5000\", \"32.0000\", \"59.0000\", \"\", \"35.0000\", \"1.6000\", \"1.1000\", \"1.2000\", \"58\", \"58\", \"58\", \"56\"",
      "measurementAccuracy": "",
      "measurementUnit": "Cm",
      "measurementDeterminedBy": "Pedro Henrique Braga Clerier",
      "measurementDeterminedDate": "16/02/2025"
    },
    {
      "type": "PhysicalObject",
      "modified": "2025-02-19T17:49:09-03:00",
      "language": "pt_BR",
      "institutionCode": "Trecho 04",
      "datasetName": "PMP-BS Área SC/PR",
      "ownerInstitutionCode": "Trecho 04",
      "basisOfRecord": "LivingSpecimen",
      "dynamicProperties": "[{\"TSN\": \"173833\", }]",
      "occurrenceID": "urn:[Trecho 04]:PMP_BS:SIMBA_171911",
      "recordNumber": "171911",
      "recordedBy": "Jeferson Dick",
      "individualCount": "1",
      "organismQuantity": "1",
      "organismQuantityType": "individuals",
      "associatedMedia": "https://simba.petrobras.com.br/uploads/pmp_8/executing_institution_201/individual_fauna_occurrence/67ab5698f3c6f.jpg, https://simba.petrobras.com.br/uploads/pmp_8/executing_institution_201/individual_fauna_occurrence/67ab569e9bb6f.jpg, https://simba.petrobras.com.br/uploads/pmp_8/executing_institution_201/individual_fauna_occurrence/67ab56a464166.jpg",
      "occurrenceRemarks": "",
      "organismID": "171911",
      "organismScope": "organismo multicelular",
      "eventID": "69502",
      "event": "Acionamento",
      "parentEventID": "171911",
      "fieldNumber": "",
      "eventRemarks": "Acionamento | Data: 11/02/2025 13:13",
      "eventDate": "2025-02-11T13:30:00-03:00",
      "locationID": "201052",
      "continent": "América do Sul",
      "country": "Brasil",
      "countryCode": "BR",
      "stateProvince": "Santa Catarina",
      "municipality": "Penha",
      "locality": "Praia do Trapiche / Cascalho",
      "decimalLatitude": "-26.7888232",
      "decimalLongitude": "-48.6046614",
      "geodeticDatum": "SIRGAS2000",
      "habitat": "Arenoso",
      "scientificName": "Chelonia mydas",
      "sex": "Indefinido",
      "lifeStage": "Juvenil",
      "kingdom": "Animalia",
      "phylum": "Chordate",
      "class": "Reptilia",
      "order": "Testudines",
      "family": "Cheloniidae",
      "genus": "Chelonia",
      "specificEpithet": "mydas",
      "taxonRank": "Espécie",
      "measurementID": "ID: 192617, Quelônio",
      "measurementType": "\"Comprimento total\", \"Comprimento curvilíneo carapaça\", \"Largura máxima curvilínea carapaça\", \"Comprimento curvilíneo plastrão\", \"Largura máxima curvilínea plastrão\", \"Comprimento cabeça\", \"Largura máxima cabeça\", \"Comprimento cloaca ao final cauda\", \"Comprimento plastrão ao final cauda\", \"Peso total\"",
      "measurementValue": "\"\", \"33.0000\", \"28.5000\", \"25.0000\", \"\", \"8.4000\", \"5.5000\", \"\", \"\", \"\"",
      "measurementAccuracy": "",
      "measurementUnit": "Cm",
      "measurementDeterminedBy": "Rafael Ricardo Liberato da Silva",
      "measurementDeterminedDate": "11/02/2025"
    },
    {
      "type": "PhysicalObject",
      "modified": "2025-02-11T19:04:35-03:00",
      "language": "pt_BR",
      "institutionCode": "Trecho 04",
      "datasetName": "PMP-BS Área SC/PR",
      "ownerInstitutionCode": "Trecho 04",
      "basisOfRecord": "LivingSpecimen",
      "dynamicProperties": "[{\"TSN\": \"173830\", }]",
      "occurrenceID": "urn:[Trecho 04]:PMP_BS:SIMBA_218543",
      "recordNumber": "218543",
      "recordedBy": "Isabela dos Santos David",
      "individualCount": "1",
      "organismQuantity": "1",
      "organismQuantityType": "individuals",
      "associatedMedia": "https://simba.petrobras.com.br/uploads/pmp_8/executing_institution_201/individual_fauna_occurrence/67aa0e1da12c0.jpg, https://simba.petrobras.com.br/uploads/pmp_8/executing_institution_201/individual_fauna_occurrence/67aa0e21c516d.jpg, https://simba.petrobras.com.br/uploads/pmp_8/executing_institution_201/individual_fauna_occurrence/67aa0e260edeb.jpg, https://simba.petrobras.com.br/uploads/pmp_8/executing_institution_201/individual_fauna_occurrence/67aa0e2b4ff8d.jpg, https://simba.petrobras.com.br/uploads/pmp_8/executing_institution_201/individual_fauna_occurrence/67aa0e2fe5ec9.jpg, https://simba.petrobras.com.br/uploads/pmp_8/executing_institution_201/individual_fauna_occurrence/67aa0e35237df.jpg, https://simba.petrobras.com.br/uploads/pmp_8/executing_institution_201/individual_fauna_occurrence/67aa0e38ce238.jpg",
      "occurrenceRemarks": "",
      "organismID": "218543",
      "organismScope": "organismo multicelular",
      "eventID": "1935626",
      "event": "Monitoramento",
      "parentEventID": "218543",
      "fieldNumber": "",
      "eventRemarks": "Regular | Início: 10/02/2025 10:53 | Fim: 10/02/2025 11:29 | Ponto inicial: (Long: -48.640685, Lat: -26.7673867) | Ponto final: (Long: -48.60471, Lat: -26.7886217)",
      "eventDate": "2025-02-10T11:09:00-03:00",
      "locationID": "201061",
      "continent": "América do Sul",
      "country": "Brasil",
      "countryCode": "BR",
      "stateProvince": "Santa Catarina",
      "municipality": "Penha",
      "locality": "Armação",
      "decimalLatitude": "-26.789155",
      "decimalLongitude": "-48.62048",
      "geodeticDatum": "SIRGAS2000",
      "habitat": "Arenoso",
      "scientificName": "Caretta caretta",
      "sex": "Indefinido",
      "lifeStage": "Indeterminado",
      "kingdom": "Animalia",
      "phylum": "Chordate",
      "class": "Reptilia",
      "order": "Testudines",
      "family": "Cheloniidae",
      "genus": "Caretta",
      "specificEpithet": "caretta",
      "taxonRank": "Espécie",
      "measurementID": "ID: 192548, Quelônio",
      "measurementType": "\"Comprimento total\", \"Comprimento curvilíneo carapaça\", \"Largura máxima curvilínea carapaça\", \"Comprimento curvilíneo plastrão\", \"Largura máxima curvilínea plastrão\", \"Comprimento cabeça\", \"Largura máxima cabeça\", \"Comprimento cloaca ao final cauda\", \"Comprimento plastrão ao final cauda\", \"Peso total\"",
      "measurementValue": "\"\", \"\", \"47.5000\", \"\", \"\", \"\", \"\", \"\", \"\", \"\"",
      "measurementAccuracy": "",
      "measurementUnit": "Cm",
      "measurementDeterminedBy": "Douglas Coutinho Machado",
      "measurementDeterminedDate": "10/02/2025"
    },
    {
      "type": "PhysicalObject",
      "modified": "2025-02-04T13:19:25-03:00",
      "language": "pt_BR",
      "institutionCode": "Trecho 04",
      "datasetName": "PMP-BS Área SC/PR",
      "ownerInstitutionCode": "Trecho 04",
      "basisOfRecord": "LivingSpecimen",
      "dynamicProperties": "[{\"TSN\": \"173833\", }]",
      "occurrenceID": "urn:[Trecho 04]:PMP_BS:SIMBA_238912",
      "recordNumber": "238912",
      "recordedBy": "Isabela dos Santos David",
      "individualCount": "1",
      "organismQuantity": "1",
      "organismQuantityType": "individuals",
      "associatedMedia": "https://simba.petrobras.com.br/uploads/pmp_8/executing_institution_201/individual_fauna_occurrence/67a0c6f9be9d3.jpg, https://simba.petrobras.com.br/uploads/pmp_8/executing_institution_201/individual_fauna_occurrence/67a0c6ff225c3.jpg, https://simba.petrobras.com.br/uploads/pmp_8/executing_institution_201/individual_fauna_occurrence/67a0c730b8a91.jpg, https://simba.petrobras.com.br/uploads/pmp_8/executing_institution_201/individual_fauna_occurrence/67a0c735d3551.jpg, https://simba.petrobras.com.br/uploads/pmp_8/executing_institution_201/individual_fauna_occurrence/67a0c73a7fd92.jpg, https://simba.petrobras.com.br/uploads/pmp_8/executing_institution_201/individual_fauna_occurrence/67a0c73f7b111.jpg",
      "occurrenceRemarks": "",
      "organismID": "238912",
      "organismScope": "organismo multicelular",
      "eventID": "1930467",
      "event": "Monitoramento",
      "parentEventID": "238912",
      "fieldNumber": "",
      "eventRemarks": "Regular | Início: 03/02/2025 11:36 | Fim: 03/02/2025 11:45 | Ponto inicial: (Long: -48.6103043, Lat: -26.8262886) | Ponto final: (Long: -48.6158531, Lat: -26.8256033)",
      "eventDate": "2025-02-03T11:39:00-03:00",
      "locationID": "201011",
      "continent": "América do Sul",
      "country": "Brasil",
      "countryCode": "BR",
      "stateProvince": "Santa Catarina",
      "municipality": "Penha",
      "locality": "São Miguel",
      "decimalLatitude": "-26.8251383",
      "decimalLongitude": "-48.613205",
      "geodeticDatum": "SIRGAS2000",
      "habitat": "Arenoso",
      "scientificName": "Chelonia mydas",
      "sex": "Indefinido",
      "lifeStage": "Juvenil",
      "kingdom": "Animalia",
      "phylum": "Chordate",
      "class": "Reptilia",
      "order": "Testudines",
      "family": "Cheloniidae",
      "genus": "Chelonia",
      "specificEpithet": "mydas",
      "taxonRank": "Espécie",
      "measurementID": "ID: 192150, Quelônio",
      "measurementType": "\"Comprimento total\", \"Comprimento curvilíneo carapaça\", \"Largura máxima curvilínea carapaça\", \"Comprimento curvilíneo plastrão\", \"Largura máxima curvilínea plastrão\", \"Comprimento cabeça\", \"Largura máxima cabeça\", \"Comprimento cloaca ao final cauda\", \"Comprimento plastrão ao final cauda\", \"Peso total\"",
      "measurementValue": "\"\", \"39.2000\", \"37.0000\", \"32.0000\", \"29.5000\", \"9.4000\", \"5.9000\", \"1.8000\", \"4.1000\", \"\"",
      "measurementAccuracy": "",
      "measurementUnit": "Cm",
      "measurementDeterminedBy": "Rafael Ricardo Liberato da Silva",
      "measurementDeterminedDate": "03/02/2025"
    },
    {
      "type": "PhysicalObject",
      "modified": "2025-01-26T14:19:52-03:00",
      "language": "pt_BR",
      "institutionCode": "Trecho 04",
      "datasetName": "PMP-BS Área SC/PR",
      "ownerInstitutionCode": "Trecho 04",
      "basisOfRecord": "LivingSpecimen",
      "dynamicProperties": "[{\"TSN\": \"173833\", }]",
      "occurrenceID": "urn:[Trecho 04]:PMP_BS:SIMBA_236340",
      "recordNumber": "236340",
      "recordedBy": "Thamires Pires de Pontes",
      "individualCount": "1",
      "organismQuantity": "1",
      "organismQuantityType": "individuals",
      "associatedMedia": "https://simba.petrobras.com.br/uploads/pmp_8/executing_institution_201/individual_fauna_occurrence/67962f98c849a.jpg, https://simba.petrobras.com.br/uploads/pmp_8/executing_institution_201/individual_fauna_occurrence/67962f9d3d68b.jpg, https://simba.petrobras.com.br/uploads/pmp_8/executing_institution_201/individual_fauna_occurrence/67962fa164714.jpg, https://simba.petrobras.com.br/uploads/pmp_8/executing_institution_201/individual_fauna_occurrence/67962fa582f4b.jpg",
      "occurrenceRemarks": "",
      "organismID": "236340",
      "organismScope": "organismo multicelular",
      "eventID": "1924583",
      "event": "Monitoramento",
      "parentEventID": "236340",
      "fieldNumber": "",
      "eventRemarks": "Regular | Início: 26/01/2025 10:39 | Fim: 26/01/2025 10:51 | Ponto inicial: (Long: -48.6052966, Lat: -26.7868479) | Ponto final: (Long: -48.602314, Lat: -26.7812629)",
      "eventDate": "2025-01-26T10:47:00-03:00",
      "locationID": "201052",
      "continent": "América do Sul",
      "country": "Brasil",
      "countryCode": "BR",
      "stateProvince": "Santa Catarina",
      "municipality": "Penha",
      "locality": "Praia do Trapiche / Cascalho",
      "decimalLatitude": "-26.7850676",
      "decimalLongitude": "-48.6021423",
      "geodeticDatum": "SIRGAS2000",
      "habitat": "Arenoso",
      "scientificName": "Chelonia mydas",
      "sex": "Indefinido",
      "lifeStage": "Juvenil",
      "kingdom": "Animalia",
      "phylum": "Chordate",
      "class": "Reptilia",
      "order": "Testudines",
      "family": "Cheloniidae",
      "genus": "Chelonia",
      "specificEpithet": "mydas",
      "taxonRank": "Espécie",
      "measurementID": "ID: 191770, Quelônio",
      "measurementType": "\"Comprimento total\", \"Comprimento curvilíneo carapaça\", \"Largura máxima curvilínea carapaça\", \"Comprimento curvilíneo plastrão\", \"Largura máxima curvilínea plastrão\", \"Comprimento cabeça\", \"Largura máxima cabeça\", \"Comprimento cloaca ao final cauda\", \"Comprimento plastrão ao final cauda\", \"Peso total\"",
      "measurementValue": "\"\", \"34.0000\", \"31.0000\", \"\", \"\", \"\", \"\", \"\", \"\", \"\"",
      "measurementAccuracy": "",
      "measurementUnit": "Cm",
      "measurementDeterminedBy": "Rafael Ricardo Liberato da Silva",
      "measurementDeterminedDate": "26/01/2025"
    },
    {
      "type": "PhysicalObject",
      "modified": "2025-01-25T15:44:05-03:00",
      "language": "pt_BR",
      "institutionCode": "Trecho 04",
      "datasetName": "PMP-BS Área SC/PR",
      "ownerInstitutionCode": "Trecho 04",
      "basisOfRecord": "LivingSpecimen",
      "dynamicProperties": "[{\"TSN\": \"173833\", }]",
      "occurrenceID": "urn:[Trecho 04]:PMP_BS:SIMBA_236339",
      "recordNumber": "236339",
      "recordedBy": "Thamires Pires de Pontes",
      "individualCount": "1",
      "organismQuantity": "1",
      "organismQuantityType": "individuals",
      "associatedMedia": "https://simba.petrobras.com.br/uploads/pmp_8/executing_institution_201/individual_fauna_occurrence/679505e4ae2c4.jpg, https://simba.petrobras.com.br/uploads/pmp_8/executing_institution_201/individual_fauna_occurrence/679505ebe29ff.jpg, https://simba.petrobras.com.br/uploads/pmp_8/executing_institution_201/individual_fauna_occurrence/679505f64fa11.jpg, https://simba.petrobras.com.br/uploads/pmp_8/executing_institution_201/individual_fauna_occurrence/67950600c359b.jpg",
      "occurrenceRemarks": "devido ao avançado estado de decomposição não foi possível realizar a biometria.",
      "organismID": "236339",
      "organismScope": "organismo multicelular",
      "eventID": "69168",
      "event": "Acionamento",
      "parentEventID": "236339",
      "fieldNumber": "",
      "eventRemarks": "Acionamento | Data: 25/01/2025 14:51",
      "eventDate": "2025-01-25T14:51:00-03:00",
      "locationID": "201011",
      "continent": "América do Sul",
      "country": "Brasil",
      "countryCode": "BR",
      "stateProvince": "Santa Catarina",
      "municipality": "Penha",
      "locality": "São Miguel",
      "decimalLatitude": "-26.826602",
      "decimalLongitude": "-48.610147",
      "geodeticDatum": "SIRGAS2000",
      "habitat": "Arenoso",
      "scientificName": "Chelonia mydas",
      "sex": "Indefinido",
      "lifeStage": "Juvenil",
      "kingdom": "Animalia",
      "phylum": "Chordate",
      "class": "Reptilia",
      "order": "Testudines",
      "family": "Cheloniidae",
      "genus": "Chelonia",
      "specificEpithet": "mydas",
      "taxonRank": "Espécie"
    },
    {
      "type": "PhysicalObject",
      "modified": "2025-01-25T21:05:01-03:00",
      "language": "pt_BR",
      "institutionCode": "Trecho 04",
      "datasetName": "PMP-BS Área SC/PR",
      "ownerInstitutionCode": "Trecho 04",
      "basisOfRecord": "LivingSpecimen",
      "dynamicProperties": "[{\"TSN\": \"180411\", }]",
      "occurrenceID": "urn:[Trecho 04]:PMP_BS:SIMBA_228677",
      "recordNumber": "228677",
      "recordedBy": "Thamires Pires de Pontes",
      "individualCount": "1",
      "organismQuantity": "1",
      "organismQuantityType": "individuals",
      "associatedMedia": "https://simba.petrobras.com.br/uploads/pmp_8/executing_institution_201/individual_fauna_occurrence/6793c9382d5f2.jpg",
      "occurrenceRemarks": "Coleta de amostras biológicas e biometria não realizadas devido ao avançado estágio de decomposição do animal.\nFotos com escala perdidas na sincronização das imagens.",
      "organismID": "228677",
      "organismScope": "organismo multicelular",
      "eventID": "1923450",
      "event": "Monitoramento",
      "parentEventID": "228677",
      "fieldNumber": "",
      "eventRemarks": "Regular | Início: 24/01/2025 12:34 | Fim: 24/01/2025 12:58 | Ponto inicial: (Long: -48.640755, Lat: -26.7693183) | Ponto final: (Long: -48.60471, Lat: -26.7886667)",
      "eventDate": "2025-01-24T12:42:00-03:00",
      "locationID": "201061",
      "continent": "América do Sul",
      "country": "Brasil",
      "countryCode": "BR",
      "stateProvince": "Santa Catarina",
      "municipality": "Penha",
      "locality": "Armação",
      "decimalLatitude": "-26.77357",
      "decimalLongitude": "-48.637785",
      "geodeticDatum": "SIRGAS2000",
      "habitat": "Arenoso",
      "scientificName": "Pontoporia blainvillei",
      "sex": "Indefinido",
      "lifeStage": "Indeterminado",
      "kingdom": "Animalia",
      "phylum": "Chordate",
      "class": "Mammalia",
      "order": "Cetacea",
      "family": "Iniidae",
      "genus": "Pontoporia",
      "specificEpithet": "blainvillei",
      "taxonRank": "Espécie"
    },
    {
      "type": "PhysicalObject",
      "modified": "2025-01-23T13:20:58-03:00",
      "language": "pt_BR",
      "institutionCode": "Trecho 04",
      "datasetName": "PMP-BS Área SC/PR",
      "ownerInstitutionCode": "Trecho 04",
      "basisOfRecord": "LivingSpecimen",
      "dynamicProperties": "[{\"TSN\": \"176849\", }]",
      "occurrenceID": "urn:[Trecho 04]:PMP_BS:SIMBA_228674",
      "recordNumber": "228674",
      "recordedBy": "Thamires Pires de Pontes",
      "individualCount": "1",
      "organismQuantity": "1",
      "organismQuantityType": "individuals",
      "associatedMedia": "https://simba.petrobras.com.br/uploads/pmp_8/executing_institution_201/individual_fauna_occurrence/679241b57ade4.jpg, https://simba.petrobras.com.br/uploads/pmp_8/executing_institution_201/individual_fauna_occurrence/679241b9d36ea.jpg, https://simba.petrobras.com.br/uploads/pmp_8/executing_institution_201/individual_fauna_occurrence/679241be2fd29.jpg, https://simba.petrobras.com.br/uploads/pmp_8/executing_institution_201/individual_fauna_occurrence/679241c253733.jpg, https://simba.petrobras.com.br/uploads/pmp_8/executing_institution_201/individual_fauna_occurrence/679241c7da8d5.jpg",
      "occurrenceRemarks": "Não foi possível realizar todas as biometrias devido ao avançado estágio de decomposição.",
      "organismID": "228674",
      "organismScope": "organismo multicelular",
      "eventID": "1922515",
      "event": "Monitoramento",
      "parentEventID": "228674",
      "fieldNumber": "",
      "eventRemarks": "Regular | Início: 23/01/2025 11:14 | Fim: 23/01/2025 11:16 | Ponto inicial: (Long: -48.616258, Lat: -26.825579) | Ponto final: (Long: -48.6102378, Lat: -26.8263414)",
      "eventDate": "2025-01-23T11:16:00-03:00",
      "locationID": "201011",
      "continent": "América do Sul",
      "country": "Brasil",
      "countryCode": "BR",
      "stateProvince": "Santa Catarina",
      "municipality": "Penha",
      "locality": "São Miguel",
      "decimalLatitude": "-26.82645",
      "decimalLongitude": "-48.6101733",
      "geodeticDatum": "SIRGAS2000",
      "habitat": "Arenoso",
      "scientificName": "Larus dominicanus",
      "sex": "Indefinido",
      "lifeStage": "Adulto",
      "kingdom": "Animalia",
      "phylum": "Chordate",
      "class": "Aves",
      "order": "Charadriiformes",
      "family": "Laridae",
      "genus": "Larus",
      "specificEpithet": "dominicanus",
      "taxonRank": "Espécie",
      "measurementID": "ID: 191624, Aves voadoras",
      "measurementType": "\"Comprimento da cabeça\", \"Altura do bico (na base)\", \"Altura do bico (em frente da narina-mínima)\", \"Altura do bico (na gônis)\", \"Largura do bico (na base)\", \"Comprimento do bico\", \"Comprimento narina-ponta\", \"Comprimento do tarso\", \"Comprimento do membro posterior (pé)\", \"Comprimento do dedo médio (com unha)\", \"Comprimento do dedo médio (sem unha)\", \"Comprimento total (corpo-bico)\", \"Corda da asa (achatada)\", \"Envergadura\", \"Largura da asa\", \"Comprimento da cauda\", \"Diâmetro do tarso\", \"Peso total\"",
      "measurementValue": "\"12.5000\", \"1.9000\", \"2.0000\", \"2.2000\", \"1.3000\", \"4.9000\", \"2.5000\", \"7.9000\", \"6.2000\", \"6.0000\", \"5.0000\", \"\", \"38.5000\", \"\", \"14.0000\", \"\", \"0.9000\", \"\"",
      "measurementAccuracy": "",
      "measurementUnit": "Cm",
      "measurementDeterminedBy": "Pedro Henrique Braga Clerier",
      "measurementDeterminedDate": "23/01/2025"
    },
    {
      "type": "PhysicalObject",
      "modified": "2025-01-19T16:16:02-03:00",
      "language": "pt_BR",
      "institutionCode": "Trecho 04",
      "datasetName": "PMP-BS Área SC/PR",
      "ownerInstitutionCode": "Trecho 04",
      "basisOfRecord": "LivingSpecimen",
      "dynamicProperties": "[{\"TSN\": \"173833\", }]",
      "occurrenceID": "urn:[Trecho 04]:PMP_BS:SIMBA_228055",
      "recordNumber": "228055",
      "recordedBy": "Thamires Pires de Pontes",
      "individualCount": "1",
      "organismQuantity": "1",
      "organismQuantityType": "individuals",
      "associatedMedia": "https://simba.petrobras.com.br/uploads/pmp_8/executing_institution_201/individual_fauna_occurrence/678d076e6188f.jpg, https://simba.petrobras.com.br/uploads/pmp_8/executing_institution_201/individual_fauna_occurrence/678d0776330e8.jpg, https://simba.petrobras.com.br/uploads/pmp_8/executing_institution_201/individual_fauna_occurrence/678d07880c068.jpg, https://simba.petrobras.com.br/uploads/pmp_8/executing_institution_201/individual_fauna_occurrence/678d079d703da.jpg, https://simba.petrobras.com.br/uploads/pmp_8/executing_institution_201/individual_fauna_occurrence/678d07a6da8c6.jpg, https://simba.petrobras.com.br/uploads/pmp_8/executing_institution_201/individual_fauna_occurrence/678d07bac4f20.jpg",
      "occurrenceRemarks": "",
      "organismID": "228055",
      "organismScope": "organismo multicelular",
      "eventID": "69034",
      "event": "Acionamento",
      "parentEventID": "228055",
      "fieldNumber": "",
      "eventRemarks": "Acionamento | Data: 18/01/2025 17:53",
      "eventDate": "2025-01-19T11:49:00-03:00",
      "locationID": "201061",
      "continent": "América do Sul",
      "country": "Brasil",
      "countryCode": "BR",
      "stateProvince": "Santa Catarina",
      "municipality": "Penha",
      "locality": "Armação",
      "decimalLatitude": "-26.7850983",
      "decimalLongitude": "-48.6279417",
      "geodeticDatum": "SIRGAS2000",
      "habitat": "Arenoso",
      "scientificName": "Chelonia mydas",
      "sex": "Indefinido",
      "lifeStage": "Juvenil",
      "kingdom": "Animalia",
      "phylum": "Chordate",
      "class": "Reptilia",
      "order": "Testudines",
      "family": "Cheloniidae",
      "genus": "Chelonia",
      "specificEpithet": "mydas",
      "taxonRank": "Espécie",
      "measurementID": "ID: 191359, Quelônio",
      "measurementType": "\"Comprimento total\", \"Comprimento curvilíneo carapaça\", \"Largura máxima curvilínea carapaça\", \"Comprimento curvilíneo plastrão\", \"Largura máxima curvilínea plastrão\", \"Comprimento cabeça\", \"Largura máxima cabeça\", \"Comprimento cloaca ao final cauda\", \"Comprimento plastrão ao final cauda\", \"Peso total\"",
      "measurementValue": "\"40.0000\", \"31.0000\", \"29.0000\", \"25.0000\", \"23.0000\", \"9.0000\", \"6.0000\", \"\", \"\", \"\"",
      "measurementAccuracy": "",
      "measurementUnit": "Cm",
      "measurementDeterminedBy": "Douglas Coutinho Machado",
      "measurementDeterminedDate": "19/01/2025"
    },
    {
      "type": "PhysicalObject",
      "modified": "2025-03-26T13:46:49-03:00",
      "language": "pt_BR",
      "institutionCode": "Trecho 04",
      "datasetName": "PMP-BS Área SC/PR",
      "ownerInstitutionCode": "Trecho 04",
      "basisOfRecord": "LivingSpecimen",
      "dynamicProperties": "[{\"TSN\": \"173830\", }]",
      "occurrenceID": "urn:[Trecho 04]:PMP_BS:SIMBA_226091",
      "recordNumber": "226091",
      "recordedBy": "Jeferson Dick",
      "individualCount": "1",
      "organismQuantity": "1",
      "organismQuantityType": "individuals",
      "associatedMedia": "https://simba.petrobras.com.br/uploads/pmp_8/executing_institution_201/individual_fauna_occurrence/6787f68c1b81a.jpg, https://simba.petrobras.com.br/uploads/pmp_8/executing_institution_201/individual_fauna_occurrence/6787f691d207e.jpg, https://simba.petrobras.com.br/uploads/pmp_8/executing_institution_201/individual_fauna_occurrence/6787f69a0af41.jpg, https://simba.petrobras.com.br/uploads/pmp_8/executing_institution_201/individual_fauna_occurrence/6787f6a2e6cae.jpg, https://simba.petrobras.com.br/uploads/pmp_8/executing_institution_201/individual_fauna_occurrence/6787f6aaac2ca.jpg",
      "occurrenceRemarks": "Não foi possível realizar todas as biometrias devido ao avançado estágio de decomposição.",
      "organismID": "226091",
      "organismScope": "organismo multicelular",
      "eventID": "68956",
      "event": "Acionamento",
      "parentEventID": "226091",
      "fieldNumber": "",
      "eventRemarks": "Acionamento | Data: 15/01/2025 16:06",
      "eventDate": "2025-01-15T17:00:00-03:00",
      "locationID": "201071",
      "continent": "América do Sul",
      "country": "Brasil",
      "countryCode": "BR",
      "stateProvince": "Santa Catarina",
      "municipality": "Penha",
      "locality": "Bacia da Vovó",
      "decimalLatitude": "-26.763295",
      "decimalLongitude": "-48.6464017",
      "geodeticDatum": "SIRGAS2000",
      "habitat": "Arenoso",
      "scientificName": "Caretta caretta",
      "sex": "Macho",
      "lifeStage": "Adulto",
      "kingdom": "Animalia",
      "phylum": "Chordate",
      "class": "Reptilia",
      "order": "Testudines",
      "family": "Cheloniidae",
      "genus": "Caretta",
      "specificEpithet": "caretta",
      "taxonRank": "Espécie",
      "measurementID": "ID: 191093, Quelônio",
      "measurementType": "\"Comprimento total\", \"Comprimento curvilíneo carapaça\", \"Largura máxima curvilínea carapaça\", \"Comprimento curvilíneo plastrão\", \"Largura máxima curvilínea plastrão\", \"Comprimento cabeça\", \"Largura máxima cabeça\", \"Comprimento cloaca ao final cauda\", \"Comprimento plastrão ao final cauda\", \"Peso total\"",
      "measurementValue": "\"1.2800\", \"\", \"\", \"\", \"\", \"26.0000\", \"20.0000\", \"\", \"\", \"85.8000\"",
      "measurementAccuracy": "",
      "measurementUnit": "Cm",
      "measurementDeterminedBy": "Pedro Henrique Braga Clerier",
      "measurementDeterminedDate": "15/01/2025"
    },
    {
      "type": "PhysicalObject",
      "modified": "",
      "language": "pt_BR",
      "institutionCode": "Trecho 04",
      "datasetName": "PMP-BS Área SC/PR",
      "ownerInstitutionCode": "Trecho 04",
      "basisOfRecord": "LivingSpecimen",
      "dynamicProperties": "[{\"TSN\": \"554375\", }]",
      "occurrenceID": "urn:[Trecho 04]:PMP_BS:SIMBA_227585",
      "recordNumber": "227585",
      "recordedBy": "Isabela dos Santos David",
      "individualCount": "1",
      "organismQuantity": "1",
      "organismQuantityType": "individuals",
      "associatedMedia": "https://simba.petrobras.com.br/uploads/pmp_8/executing_institution_201/individual_fauna_occurrence/6787c6132b5d1.jpg, https://simba.petrobras.com.br/uploads/pmp_8/executing_institution_201/individual_fauna_occurrence/6787c6176122e.jpg, https://simba.petrobras.com.br/uploads/pmp_8/executing_institution_201/individual_fauna_occurrence/6787c61bb445e.jpg, https://simba.petrobras.com.br/uploads/pmp_8/executing_institution_201/individual_fauna_occurrence/6787c6201d303.jpg, https://simba.petrobras.com.br/uploads/pmp_8/executing_institution_201/individual_fauna_occurrence/6787c623c0303.jpg",
      "occurrenceRemarks": "",
      "organismID": "227585",
      "organismScope": "organismo multicelular",
      "eventID": "1916741",
      "event": "Monitoramento",
      "parentEventID": "227585",
      "fieldNumber": "",
      "eventRemarks": "Regular | Início: 15/01/2025 12:57 | Fim: 15/01/2025 13:09 | Ponto inicial: (Long: -48.6103917, Lat: -26.8263654) | Ponto final: (Long: -48.616495, Lat: -26.8254933)",
      "eventDate": "2025-01-15T13:00:00-03:00",
      "locationID": "201011",
      "continent": "América do Sul",
      "country": "Brasil",
      "countryCode": "BR",
      "stateProvince": "Santa Catarina",
      "municipality": "Penha",
      "locality": "São Miguel",
      "decimalLatitude": "-26.82528",
      "decimalLongitude": "-48.61262",
      "geodeticDatum": "SIRGAS2000",
      "habitat": "Arenoso",
      "scientificName": "Phalacrocorax brasilianus",
      "sex": "Indefinido",
      "lifeStage": "Juvenil",
      "kingdom": "Animalia",
      "phylum": "Chordate",
      "class": "Aves",
      "order": "Suliformes",
      "family": "Phalacrocoracidae",
      "genus": "Phalacrocorax",
      "specificEpithet": "brasilianus",
      "taxonRank": "Espécie",
      "measurementID": "ID: 191079, Aves voadoras",
      "measurementType": "\"Comprimento da cabeça\", \"Altura do bico (na base)\", \"Altura do bico (em frente da narina-mínima)\", \"Altura do bico (na gônis)\", \"Largura do bico (na base)\", \"Comprimento do bico\", \"Comprimento narina-ponta\", \"Comprimento do tarso\", \"Comprimento do membro posterior (pé)\", \"Comprimento do dedo médio (com unha)\", \"Comprimento do dedo médio (sem unha)\", \"Comprimento total (corpo-bico)\", \"Corda da asa (achatada)\", \"Envergadura\", \"Largura da asa\", \"Comprimento da cauda\", \"Diâmetro do tarso\", \"Peso total\"",
      "measurementValue": "\"14.0000\", \"2.1000\", \"\", \"\", \"1.3000\", \"6.0000\", \"\", \"4.0000\", \"10.5000\", \"6.5000\", \"5.8000\", \"73.0000\", \"28.0000\", \"116.0000\", \"18.0000\", \"20.0000\", \"1.6000\", \"\"",
      "measurementAccuracy": "",
      "measurementUnit": "Cm",
      "measurementDeterminedBy": "Mauro Giovanni Miglioli",
      "measurementDeterminedDate": "15/01/2025"
    },
    {
      "type": "PhysicalObject",
      "modified": "2025-01-17T14:30:50-03:00",
      "language": "pt_BR",
      "institutionCode": "Trecho 04",
      "datasetName": "PMP-BS Área SC/PR",
      "ownerInstitutionCode": "Trecho 04",
      "basisOfRecord": "LivingSpecimen",
      "dynamicProperties": "[{\"TSN\": \"173833\", }]",
      "occurrenceID": "urn:[Trecho 04]:PMP_BS:SIMBA_227584",
      "recordNumber": "227584",
      "recordedBy": "Isabela dos Santos David",
      "individualCount": "1",
      "organismQuantity": "1",
      "organismQuantityType": "individuals",
      "associatedMedia": "https://simba.petrobras.com.br/uploads/pmp_8/executing_institution_201/individual_fauna_occurrence/6787c63c57db5.jpg, https://simba.petrobras.com.br/uploads/pmp_8/executing_institution_201/individual_fauna_occurrence/6787c640a2a46.jpg, https://simba.petrobras.com.br/uploads/pmp_8/executing_institution_201/individual_fauna_occurrence/6787c64558158.jpg, https://simba.petrobras.com.br/uploads/pmp_8/executing_institution_201/individual_fauna_occurrence/6787c65e21158.jpg, https://simba.petrobras.com.br/uploads/pmp_8/executing_institution_201/individual_fauna_occurrence/6787c684d72d9.jpg",
      "occurrenceRemarks": "",
      "organismID": "227584",
      "organismScope": "organismo multicelular",
      "eventID": "1916737",
      "event": "Monitoramento",
      "parentEventID": "227584",
      "fieldNumber": "",
      "eventRemarks": "Regular | Início: 15/01/2025 11:35 | Fim: 15/01/2025 12:11 | Ponto inicial: (Long: -48.6407617, Lat: -26.7690983) | Ponto final: (Long: -48.6053533, Lat: -26.789075)",
      "eventDate": "2025-01-15T12:00:00-03:00",
      "locationID": "201061",
      "continent": "América do Sul",
      "country": "Brasil",
      "countryCode": "BR",
      "stateProvince": "Santa Catarina",
      "municipality": "Penha",
      "locality": "Armação",
      "decimalLatitude": "-26.785645",
      "decimalLongitude": "-48.6270417",
      "geodeticDatum": "SIRGAS2000",
      "habitat": "Arenoso",
      "scientificName": "Chelonia mydas",
      "sex": "Indefinido",
      "lifeStage": "Juvenil",
      "kingdom": "Animalia",
      "phylum": "Chordate",
      "class": "Reptilia",
      "order": "Testudines",
      "family": "Cheloniidae",
      "genus": "Chelonia",
      "specificEpithet": "mydas",
      "taxonRank": "Espécie",
      "measurementID": "ID: 191081, Quelônio",
      "measurementType": "\"Comprimento total\", \"Comprimento curvilíneo carapaça\", \"Largura máxima curvilínea carapaça\", \"Comprimento curvilíneo plastrão\", \"Largura máxima curvilínea plastrão\", \"Comprimento cabeça\", \"Largura máxima cabeça\", \"Comprimento cloaca ao final cauda\", \"Comprimento plastrão ao final cauda\", \"Peso total\"",
      "measurementValue": "\"58.0000\", \"43.0000\", \"41.0000\", \"36.0000\", \"35.0000\", \"12.0000\", \"8.0000\", \"\", \"\", \"\"",
      "measurementAccuracy": "",
      "measurementUnit": "Cm",
      "measurementDeterminedBy": "Mauro Giovanni Miglioli",
      "measurementDeterminedDate": "15/01/2025"
    },
    {
      "type": "PhysicalObject",
      "modified": "2025-01-17T14:24:43-03:00",
      "language": "pt_BR",
      "institutionCode": "Trecho 04",
      "datasetName": "PMP-BS Área SC/PR",
      "ownerInstitutionCode": "Trecho 04",
      "basisOfRecord": "LivingSpecimen",
      "dynamicProperties": "[{\"TSN\": \"173833\", }]",
      "occurrenceID": "urn:[Trecho 04]:PMP_BS:SIMBA_227583",
      "recordNumber": "227583",
      "recordedBy": "Isabela dos Santos David",
      "individualCount": "1",
      "organismQuantity": "1",
      "organismQuantityType": "individuals",
      "associatedMedia": "https://simba.petrobras.com.br/uploads/pmp_8/executing_institution_201/individual_fauna_occurrence/6787c6279e0ba.jpg, https://simba.petrobras.com.br/uploads/pmp_8/executing_institution_201/individual_fauna_occurrence/6787c62c6b8b6.jpg, https://simba.petrobras.com.br/uploads/pmp_8/executing_institution_201/individual_fauna_occurrence/6787c630af0b8.jpg, https://simba.petrobras.com.br/uploads/pmp_8/executing_institution_201/individual_fauna_occurrence/6787c634dfc68.jpg, https://simba.petrobras.com.br/uploads/pmp_8/executing_institution_201/individual_fauna_occurrence/6787c63893638.jpg",
      "occurrenceRemarks": "",
      "organismID": "227583",
      "organismScope": "organismo multicelular",
      "eventID": "1916737",
      "event": "Monitoramento",
      "parentEventID": "227583",
      "fieldNumber": "",
      "eventRemarks": "Regular | Início: 15/01/2025 11:35 | Fim: 15/01/2025 12:11 | Ponto inicial: (Long: -48.6407617, Lat: -26.7690983) | Ponto final: (Long: -48.6053533, Lat: -26.789075)",
      "eventDate": "2025-01-15T11:45:00-03:00",
      "locationID": "201061",
      "continent": "América do Sul",
      "country": "Brasil",
      "countryCode": "BR",
      "stateProvince": "Santa Catarina",
      "municipality": "Penha",
      "locality": "Armação",
      "decimalLatitude": "-26.7702933",
      "decimalLongitude": "-48.6396133",
      "geodeticDatum": "SIRGAS2000",
      "habitat": "Arenoso",
      "scientificName": "Chelonia mydas",
      "sex": "Indefinido",
      "lifeStage": "Juvenil",
      "kingdom": "Animalia",
      "phylum": "Chordate",
      "class": "Reptilia",
      "order": "Testudines",
      "family": "Cheloniidae",
      "genus": "Chelonia",
      "specificEpithet": "mydas",
      "taxonRank": "Espécie",
      "measurementID": "ID: 191080, Quelônio",
      "measurementType": "\"Comprimento total\", \"Comprimento curvilíneo carapaça\", \"Largura máxima curvilínea carapaça\", \"Comprimento curvilíneo plastrão\", \"Largura máxima curvilínea plastrão\", \"Comprimento cabeça\", \"Largura máxima cabeça\", \"Comprimento cloaca ao final cauda\", \"Comprimento plastrão ao final cauda\", \"Peso total\"",
      "measurementValue": "\"50.0000\", \"36.0000\", \"34.0000\", \"30.0000\", \"27.0000\", \"9.5000\", \"6.5000\", \"\", \"5.5000\", \"\"",
      "measurementAccuracy": "",
      "measurementUnit": "Cm",
      "measurementDeterminedBy": "Mauro Giovanni Miglioli",
      "measurementDeterminedDate": "15/01/2025"
    },
    {
      "type": "PhysicalObject",
      "modified": "2025-01-15T18:52:45-03:00",
      "language": "pt_BR",
      "institutionCode": "Trecho 04",
      "datasetName": "PMP-BS Área SC/PR",
      "ownerInstitutionCode": "Trecho 04",
      "basisOfRecord": "LivingSpecimen",
      "dynamicProperties": "[{\"TSN\": \"173833\", }]",
      "occurrenceID": "urn:[Trecho 04]:PMP_BS:SIMBA_156454",
      "recordNumber": "156454",
      "recordedBy": "Thamires Pires de Pontes",
      "individualCount": "1",
      "organismQuantity": "1",
      "organismQuantityType": "individuals",
      "associatedMedia": "https://simba.petrobras.com.br/uploads/pmp_8/executing_institution_201/individual_fauna_occurrence/678674b5729ef.jpg, https://simba.petrobras.com.br/uploads/pmp_8/executing_institution_201/individual_fauna_occurrence/678674bd8496e.jpg, https://simba.petrobras.com.br/uploads/pmp_8/executing_institution_201/individual_fauna_occurrence/678674c3d72a3.jpg, https://simba.petrobras.com.br/uploads/pmp_8/executing_institution_201/individual_fauna_occurrence/678674c9e7f43.jpg, https://simba.petrobras.com.br/uploads/pmp_8/executing_institution_201/individual_fauna_occurrence/678674cf55474.jpg",
      "occurrenceRemarks": "Biometria foi perdida na sincronização.",
      "organismID": "156454",
      "organismScope": "organismo multicelular",
      "eventID": "68914",
      "event": "Acionamento",
      "parentEventID": "156454",
      "fieldNumber": "",
      "eventRemarks": "Acionamento | Data: 14/01/2025 11:55",
      "eventDate": "2025-01-14T12:36:00-03:00",
      "locationID": "201071",
      "continent": "América do Sul",
      "country": "Brasil",
      "countryCode": "BR",
      "stateProvince": "Santa Catarina",
      "municipality": "Penha",
      "locality": "Bacia da Vovó",
      "decimalLatitude": "-26.7625096",
      "decimalLongitude": "-48.6471232",
      "geodeticDatum": "SIRGAS2000",
      "habitat": "Arenoso",
      "scientificName": "Chelonia mydas",
      "sex": "Indefinido",
      "lifeStage": "Juvenil",
      "kingdom": "Animalia",
      "phylum": "Chordate",
      "class": "Reptilia",
      "order": "Testudines",
      "family": "Cheloniidae",
      "genus": "Chelonia",
      "specificEpithet": "mydas",
      "taxonRank": "Espécie",
      "measurementID": "ID: 194864, Quelônio",
      "measurementType": "\"Comprimento total\", \"Comprimento curvilíneo carapaça\", \"Largura máxima curvilínea carapaça\", \"Comprimento curvilíneo plastrão\", \"Largura máxima curvilínea plastrão\", \"Comprimento cabeça\", \"Largura máxima cabeça\", \"Comprimento cloaca ao final cauda\", \"Comprimento plastrão ao final cauda\", \"Peso total\"",
      "measurementValue": "\"56.0000\", \"40.0000\", \"38.0000\", \"33.0000\", \"31.0000\", \"11.0000\", \"7.0000\", \"\", \"\", \"\"",
      "measurementAccuracy": "",
      "measurementUnit": "Cm",
      "measurementDeterminedBy": "Mauro Giovanni Miglioli",
      "measurementDeterminedDate": "14/01/2025"
    },
    {
      "type": "PhysicalObject",
      "modified": "2025-03-09T17:36:48-03:00",
      "language": "pt_BR",
      "institutionCode": "Trecho 04",
      "datasetName": "PMP-BS Área SC/PR",
      "ownerInstitutionCode": "Trecho 04",
      "basisOfRecord": "LivingSpecimen",
      "dynamicProperties": "[{\"TSN\": \"173833\", }]",
      "occurrenceID": "urn:[Trecho 04]:PMP_BS:SIMBA_171688",
      "recordNumber": "171688",
      "recordedBy": "Thamires Pires de Pontes",
      "individualCount": "1",
      "organismQuantity": "1",
      "organismQuantityType": "individuals",
      "associatedMedia": "https://simba.petrobras.com.br/uploads/pmp_8/executing_institution_201/individual_fauna_occurrence/677d94d2eb595.jpg, https://simba.petrobras.com.br/uploads/pmp_8/executing_institution_201/individual_fauna_occurrence/677ed057e58a3.jpg, https://simba.petrobras.com.br/uploads/pmp_8/executing_institution_201/individual_fauna_occurrence/677ed05825b01.jpg, https://simba.petrobras.com.br/uploads/pmp_8/executing_institution_201/individual_fauna_occurrence/677ed07a325e4.jpg",
      "occurrenceRemarks": "Ferimentos multifocais pelo corpo. Nadadeiras posteriores com as bordas necrosadas. Carapaça frágil. Perfuração do plastrão",
      "organismID": "171688",
      "organismScope": "organismo multicelular",
      "eventID": "68792",
      "event": "Acionamento",
      "parentEventID": "171688",
      "fieldNumber": "",
      "eventRemarks": "Acionamento | Data: 07/01/2025 19:53",
      "eventDate": "2025-01-07T20:24:00-03:00",
      "locationID": "201051",
      "continent": "América do Sul",
      "country": "Brasil",
      "countryCode": "BR",
      "stateProvince": "Santa Catarina",
      "municipality": "Penha",
      "locality": "Praia do Trapiche / Cascalho",
      "decimalLatitude": "-26.7807549",
      "decimalLongitude": "-48.6034191",
      "geodeticDatum": "SIRGAS2000",
      "habitat": "Rochoso",
      "scientificName": "Chelonia mydas",
      "sex": "Macho",
      "lifeStage": "Juvenil",
      "kingdom": "Animalia",
      "phylum": "Chordate",
      "class": "Reptilia",
      "order": "Testudines",
      "family": "Cheloniidae",
      "genus": "Chelonia",
      "specificEpithet": "mydas",
      "taxonRank": "Espécie",
      "measurementID": "ID: 190609, Quelônio",
      "measurementType": "\"Comprimento total\", \"Comprimento curvilíneo carapaça\", \"Largura máxima curvilínea carapaça\", \"Comprimento curvilíneo plastrão\", \"Largura máxima curvilínea plastrão\", \"Comprimento cabeça\", \"Largura máxima cabeça\", \"Comprimento cloaca ao final cauda\", \"Comprimento plastrão ao final cauda\", \"Peso total\"",
      "measurementValue": "\"36.7000\", \"29.8000\", \"27.8000\", \"23.8000\", \"20.0000\", \"7.0000\", \"5.1000\", \"1.6000\", \"4.0000\", \"2250.0000\"",
      "measurementAccuracy": "",
      "measurementUnit": "Cm",
      "measurementDeterminedBy": "Michelly Guszak",
      "measurementDeterminedDate": "08/01/2025"
    },
    {
      "type": "PhysicalObject",
      "modified": "2025-01-12T15:01:41-03:00",
      "language": "pt_BR",
      "institutionCode": "Trecho 04",
      "datasetName": "PMP-BS Área SC/PR",
      "ownerInstitutionCode": "Trecho 04",
      "basisOfRecord": "LivingSpecimen",
      "dynamicProperties": "[{\"TSN\": \"173833\", }]",
      "occurrenceID": "urn:[Trecho 04]:PMP_BS:SIMBA_885386",
      "recordNumber": "885386",
      "recordedBy": "Isabela dos Santos David",
      "individualCount": "1",
      "organismQuantity": "1",
      "organismQuantityType": "individuals",
      "associatedMedia": "https://simba.petrobras.com.br/uploads/pmp_8/executing_institution_201/individual_fauna_occurrence/6777fe3e1f49c.jpeg, https://simba.petrobras.com.br/uploads/pmp_8/executing_institution_201/individual_fauna_occurrence/677aa3143840d.jpg, https://simba.petrobras.com.br/uploads/pmp_8/executing_institution_201/individual_fauna_occurrence/677aa314672b0.jpg, https://simba.petrobras.com.br/uploads/pmp_8/executing_institution_201/individual_fauna_occurrence/677aa29d4d82c.jpg, https://simba.petrobras.com.br/uploads/pmp_8/executing_institution_201/individual_fauna_occurrence/677aa314a1141.jpg, https://simba.petrobras.com.br/uploads/pmp_8/executing_institution_201/individual_fauna_occurrence/677aa314cc8e7.jpg",
      "occurrenceRemarks": "Tartaruga morta retirada de rede pesca pela Polícia Ambiental e deixada na base.",
      "organismID": "885386",
      "organismScope": "organismo multicelular",
      "eventID": "68685",
      "event": "Acionamento",
      "parentEventID": "885386",
      "fieldNumber": "",
      "eventRemarks": "Acionamento | Data: 03/01/2025 14:54",
      "eventDate": "2025-01-03T15:06:00-03:00",
      "locationID": "205037",
      "continent": "América do Sul",
      "country": "Brasil",
      "countryCode": "BR",
      "stateProvince": "Santa Catarina",
      "municipality": "Penha",
      "locality": "Praia não identificada",
      "decimalLatitude": "-26.78861",
      "decimalLongitude": "-48.60641",
      "geodeticDatum": "SIRGAS2000",
      "habitat": "Água",
      "scientificName": "Chelonia mydas",
      "sex": "Indefinido",
      "lifeStage": "Juvenil",
      "kingdom": "Animalia",
      "phylum": "Chordate",
      "class": "Reptilia",
      "order": "Testudines",
      "family": "Cheloniidae",
      "genus": "Chelonia",
      "specificEpithet": "mydas",
      "taxonRank": "Espécie",
      "measurementID": "ID: 190336, Quelônio",
      "measurementType": "\"Comprimento total\", \"Comprimento curvilíneo carapaça\", \"Largura máxima curvilínea carapaça\", \"Comprimento curvilíneo plastrão\", \"Largura máxima curvilínea plastrão\", \"Comprimento cabeça\", \"Largura máxima cabeça\", \"Comprimento cloaca ao final cauda\", \"Comprimento plastrão ao final cauda\", \"Peso total\"",
      "measurementValue": "\"55.0000\", \"39.0000\", \"38.0000\", \"32.5000\", \"30.5000\", \"10.0000\", \"7.0000\", \"\", \"6.8000\", \"8.6000\"",
      "measurementAccuracy": "",
      "measurementUnit": "Cm",
      "measurementDeterminedBy": "Fernanda Soto Meirelles",
      "measurementDeterminedDate": "03/01/2025"
    },
    {
      "type": "PhysicalObject",
      "modified": "",
      "language": "pt_BR",
      "institutionCode": "Trecho 04",
      "datasetName": "PMP-BS Área SC/PR",
      "ownerInstitutionCode": "Trecho 04",
      "basisOfRecord": "LivingSpecimen",
      "dynamicProperties": "[{\"TSN\": \"173833\", }]",
      "occurrenceID": "urn:[Trecho 04]:PMP_BS:SIMBA_226578",
      "recordNumber": "226578",
      "recordedBy": "Thamires Pires de Pontes",
      "individualCount": "1",
      "organismQuantity": "1",
      "organismQuantityType": "individuals",
      "associatedMedia": "https://simba.petrobras.com.br/uploads/pmp_8/executing_institution_201/individual_fauna_occurrence/6777d851d4506.jpg, https://simba.petrobras.com.br/uploads/pmp_8/executing_institution_201/individual_fauna_occurrence/6777d8586ab63.jpg, https://simba.petrobras.com.br/uploads/pmp_8/executing_institution_201/individual_fauna_occurrence/6777d8603f5f8.jpg, https://simba.petrobras.com.br/uploads/pmp_8/executing_institution_201/individual_fauna_occurrence/6777d865ab2c1.jpg, https://simba.petrobras.com.br/uploads/pmp_8/executing_institution_201/individual_fauna_occurrence/6777d86d62d2b.jpg",
      "occurrenceRemarks": "",
      "organismID": "226578",
      "organismScope": "organismo multicelular",
      "eventID": "1907617",
      "event": "Monitoramento",
      "parentEventID": "226578",
      "fieldNumber": "",
      "eventRemarks": "Regular | Início: 03/01/2025 10:05 | Fim: 03/01/2025 10:24 | Ponto inicial: (Long: -48.6410017, Lat: -26.7686617) | Ponto final: (Long: -48.6051967, Lat: -26.78898)",
      "eventDate": "2025-01-03T10:10:00-03:00",
      "locationID": "201061",
      "continent": "América do Sul",
      "country": "Brasil",
      "countryCode": "BR",
      "stateProvince": "Santa Catarina",
      "municipality": "Penha",
      "locality": "Armação",
      "decimalLatitude": "-26.776505",
      "decimalLongitude": "-48.63582",
      "geodeticDatum": "SIRGAS2000",
      "habitat": "Arenoso",
      "scientificName": "Chelonia mydas",
      "sex": "Indefinido",
      "lifeStage": "Juvenil",
      "kingdom": "Animalia",
      "phylum": "Chordate",
      "class": "Reptilia",
      "order": "Testudines",
      "family": "Cheloniidae",
      "genus": "Chelonia",
      "specificEpithet": "mydas",
      "taxonRank": "Espécie",
      "measurementID": "ID: 190308, Quelônio",
      "measurementType": "\"Comprimento total\", \"Comprimento curvilíneo carapaça\", \"Largura máxima curvilínea carapaça\", \"Comprimento curvilíneo plastrão\", \"Largura máxima curvilínea plastrão\", \"Comprimento cabeça\", \"Largura máxima cabeça\", \"Comprimento cloaca ao final cauda\", \"Comprimento plastrão ao final cauda\", \"Peso total\"",
      "measurementValue": "\"50.0000\", \"37.0000\", \"34.0000\", \"30.0000\", \"27.0000\", \"7.0000\", \"4.0000\", \"2.0000\", \"6.4000\", \"\"",
      "measurementAccuracy": "",
      "measurementUnit": "Cm",
      "measurementDeterminedBy": "Rafael Ricardo Liberato da Silva",
      "measurementDeterminedDate": "03/01/2025"
    },
    {
      "type": "PhysicalObject",
      "modified": "2025-01-03T14:31:17-03:00",
      "language": "pt_BR",
      "institutionCode": "Trecho 04",
      "datasetName": "PMP-BS Área SC/PR",
      "ownerInstitutionCode": "Trecho 04",
      "basisOfRecord": "LivingSpecimen",
      "dynamicProperties": "[{\"TSN\": \"174763\", }]",
      "occurrenceID": "urn:[Trecho 04]:PMP_BS:SIMBA_520945",
      "recordNumber": "520945",
      "recordedBy": "Thamires Pires de Pontes",
      "individualCount": "1",
      "organismQuantity": "1",
      "organismQuantityType": "individuals",
      "associatedMedia": "https://simba.petrobras.com.br/uploads/pmp_8/executing_institution_201/individual_fauna_occurrence/6777026af0400.jpeg, https://simba.petrobras.com.br/uploads/pmp_8/executing_institution_201/individual_fauna_occurrence/6777f4a3d65d5.jpg, https://simba.petrobras.com.br/uploads/pmp_8/executing_institution_201/individual_fauna_occurrence/6777f4a362938.jpg, https://simba.petrobras.com.br/uploads/pmp_8/executing_institution_201/individual_fauna_occurrence/6777f4a32c372.jpg, https://simba.petrobras.com.br/uploads/pmp_8/executing_institution_201/individual_fauna_occurrence/6777f4a3a709f.jpg",
      "occurrenceRemarks": "",
      "organismID": "520945",
      "organismScope": "organismo multicelular",
      "eventID": "68671",
      "event": "Acionamento",
      "parentEventID": "520945",
      "fieldNumber": "",
      "eventRemarks": "Acionamento | Data: 02/01/2025 19:52",
      "eventDate": "2025-01-02T20:00:00-03:00",
      "locationID": "201071",
      "continent": "América do Sul",
      "country": "Brasil",
      "countryCode": "BR",
      "stateProvince": "Santa Catarina",
      "municipality": "Penha",
      "locality": "Bacia da Vovó",
      "decimalLatitude": "-26.7632952",
      "decimalLongitude": "-48.645806",
      "geodeticDatum": "SIRGAS2000",
      "habitat": "Outros",
      "scientificName": "Fregata magnificens",
      "sex": "Fêmea",
      "lifeStage": "Adulto",
      "kingdom": "Animalia",
      "phylum": "Chordate",
      "class": "Aves",
      "order": "Suliformes",
      "family": "Fregatidae",
      "genus": "Fregata",
      "specificEpithet": "magnificens",
      "taxonRank": "Espécie",
      "measurementID": "ID: 190448, Aves voadoras",
      "measurementType": "\"Comprimento da cabeça\", \"Altura do bico (na base)\", \"Altura do bico (em frente da narina-mínima)\", \"Altura do bico (na gônis)\", \"Largura do bico (na base)\", \"Comprimento do bico\", \"Comprimento narina-ponta\", \"Comprimento do tarso\", \"Comprimento do membro posterior (pé)\", \"Comprimento do dedo médio (com unha)\", \"Comprimento do dedo médio (sem unha)\", \"Comprimento total (corpo-bico)\", \"Corda da asa (achatada)\", \"Envergadura\", \"Largura da asa\", \"Comprimento da cauda\", \"Diâmetro do tarso\", \"Peso total\"",
      "measurementValue": "\"19.5000\", \"2.7000\", \"\", \"\", \"2.6000\", \"12.3000\", \"\", \"3.4000\", \"8.8000\", \"8.3000\", \"7.0000\", \"106.0000\", \"89.0000\", \"150.0000\", \"16.5000\", \"20.0000\", \"1.1000\", \"1.7000\"",
      "measurementAccuracy": "",
      "measurementUnit": "Cm",
      "measurementDeterminedBy": "Michelly Guszak",
      "measurementDeterminedDate": "06/01/2025"
    },
    {
      "type": "PhysicalObject",
      "modified": "2025-03-01T20:26:51-03:00",
      "language": "pt_BR",
      "institutionCode": "Trecho 04",
      "datasetName": "PMP-BS Área SC/PR",
      "ownerInstitutionCode": "Trecho 04",
      "basisOfRecord": "LivingSpecimen",
      "dynamicProperties": "[{\"TSN\": \"174763\", }]",
      "occurrenceID": "urn:[Trecho 04]:PMP_BS:SIMBA_226022",
      "recordNumber": "226022",
      "recordedBy": "Thamires Pires de Pontes",
      "individualCount": "1",
      "organismQuantity": "1",
      "organismQuantityType": "individuals",
      "associatedMedia": "https://simba.petrobras.com.br/uploads/pmp_8/executing_institution_201/individual_fauna_occurrence/677704c6baa8e.png, https://simba.petrobras.com.br/uploads/pmp_8/executing_institution_201/individual_fauna_occurrence/677704e353322.png, https://simba.petrobras.com.br/uploads/pmp_8/executing_institution_201/individual_fauna_occurrence/677706959e0c8.png, https://simba.petrobras.com.br/uploads/pmp_8/executing_institution_201/individual_fauna_occurrence/677797c8ed7f7.jpg, https://simba.petrobras.com.br/uploads/pmp_8/executing_institution_201/individual_fauna_occurrence/677797cc865e9.jpg",
      "occurrenceRemarks": "",
      "organismID": "226022",
      "organismScope": "organismo multicelular",
      "eventID": "68665",
      "event": "Acionamento",
      "parentEventID": "226022",
      "fieldNumber": "",
      "eventRemarks": "Acionamento | Data: 02/01/2025 16:47",
      "eventDate": "2025-01-02T16:47:00-03:00",
      "locationID": "201061",
      "continent": "América do Sul",
      "country": "Brasil",
      "countryCode": "BR",
      "stateProvince": "Santa Catarina",
      "municipality": "Penha",
      "locality": "Armação",
      "decimalLatitude": "-26.7886161",
      "decimalLongitude": "-48.6046656",
      "geodeticDatum": "SIRGAS2000",
      "habitat": "Outros",
      "scientificName": "Fregata magnificens",
      "sex": "Macho",
      "lifeStage": "Juvenil",
      "kingdom": "Animalia",
      "phylum": "Chordate",
      "class": "Aves",
      "order": "Suliformes",
      "family": "Fregatidae",
      "genus": "Fregata",
      "specificEpithet": "magnificens",
      "taxonRank": "Espécie",
      "measurementID": "ID: 190299, Aves voadoras",
